"abstract_ts";"access_ss";"Affiliations";"Timestamp";"Author";"citation_count_i";"ID";"dtu_library_collection_facet";"collection_facet";"Publication Year";"Conference";"DOI";"Editor";"embargo_ssf";"format";"fulltext_availability_facet";"has_openaccess_fulltext_b";"holdings_ssf";"ISBN";"Journal Issue";"journal_issue_tsort";"journal_oa_model_ss";"Journal Page";"journal_page_start_tsort";"Journal Title";"journal_title_facet";"toc_key_s";"Journal Volume";"journal_vol_tsort";"keywords_ts";"keywords_facet";"keywords_normalized";"isolanguage_facet";"member_id_ss";"ORCID";"primary_member_id_s";"Publisher";"Source";"source_all_ss";"Title"
"";"dtu|dtupub";"";"2022-01-06T00:29:31.481Z";"Evans, Virginia";"";"2461220221";"";"";"1975";"";"";"";"";"article";"dtu_external|dtupub_external";"";"";"";"";"";"";"83-87";"";"Furniture History|Furniture History";"Furniture History";"00163058|000124|000011|000000|000000";"11";"";"";"";"";"eng";"5d7e4f2cd9001d01b8cae31b";"";"5d7e4f2cd9001d01b8cae31b";"Furniture History Society";"jstor";"jstor";"RECOLLECTIONS OF ROBERT W. SYMONDS"
"";"dtu|dtupub";"";"2022-01-06T10:31:46.622Z";"";"";"2460908824";"";"dtu";"2010";"";"";"";"";"other";"dtu|dtu_electronic|dtupub_external";"";"";"";"";"";"";"";"";"'atiqot / ×¢×ª××§××ª";"'atiqot / ×¢×ª××§××ª";"";"64";"";"";"";"";"eng";"5d7e350fd9001d01b8c300f6";"";"5d7e350fd9001d01b8c300f6";"רשות העתיקות";"jstor";"jstor";"Lieutenant General (Res.) Moshe Levi, 1936–2008"
"";"dtu|dtupub";"";"2022-01-10T17:03:21.991Z";"";"";"2557800381";"";"dtu";"2008";"";"10.1525/sp.2008.55.1.toc";"";"";"article";"dtu|dtu_electronic|dtupub_external";"";"";"";"1";"";"";"i-i";"";"Social Problems|Social Problems|Social Problems|Soc Probl|Soc. Probl";"Soc Probl|Soc. Probl|Social Problems";"00377791|000091|000055|000001|000000";"55";"";"";"";"";"eng";"5d062ff5d9001d394c7b6e21|56d835e8725f2ebd420b4b18";"";"5d062ff5d9001d394c7b6e21";"University of California Press";"crossref|jstor";"crossref|jstor";"Table of Contents"
"";"dtu|dtupub";"";"2022-01-05T23:25:46.791Z";"Prestwich, Menna";"";"2875069569";"";"";"1988";"";"10.1111/j.1468-229X.1988.tb02147.x";"";"";"article";"dtu_external|dtupub_external";"";"";"";"237";"";"";"63-73";"";"History|History|History|History (lond)|History London|History the Journal of the Historical Association";"History|History (lond)|History London|History the Journal of the Historical Association";"00182648|000111|000073|000237|000000";"73";"";"";"";"";"eng";"5d7e3736d9001d01b8c3a4e7|5cb4dca1d9001d01a45968b1";"";"5cb4dca1d9001d01a45968b1";"Historical Association";"jstor|crossref";"jstor|crossref";"The Revocation of the Edict of Nantes"
"";"dtu|dtupub";"";"2022-01-05T11:52:27.547Z";"v. Rohden, Fr.";"";"2520215361";"";"";"1927";"";"";"";"";"article";"dtu_external|dtupub_external";"";"";"";"2";"";"";"106-107";"";"Anthropologischer Anzeiger|Anthropologischer Anzeiger|Anthropol Anz|Anthropol. Anz";"Anthropol Anz|Anthropol. Anz|Anthropologischer Anzeiger";"00035548|000172|000004|000002|000000";"4";"";"";"";"";"ger";"5d7e513cd9001d01b8cb8723";"";"5d7e513cd9001d01b8cb8723";"E. Schweizerbart'sche Verlagsbuchhandlung";"jstor";"jstor";"Körperbau, sanitäre Konstitution und Motorik. Zschr. Neurol. Bd. 106"
"";"dtu|dtupub";"";"2022-01-05T11:41:47.495Z";"";"";"2461225867";"";"";"1984";"";"";"";"";"article";"dtu_external|dtupub_external";"";"";"";"4";"";"";"515-517";"";"Studia Diplomatica|Studia Diplomatica";"Studia Diplomatica";"07702965|000115|000037|000004|000000";"37";"";"";"";"";"fre";"5d7e4fa1d9001d01b8cb06c7";"";"5d7e4fa1d9001d01b8cb06c7";"INSTITUT ROYAL DES RELATIONS INTERNATIONALES / KONINKLIJK INSTITUUT VOOR INTERNATIONALE BETREKKINGEN";"jstor";"jstor";"DOCUMENT 2: LOI RELATIVE A LA DIVULGATION ET A LA MISE EN ŒUVRE DES INVENTIONS ET DES SECRETS DE FABRIQUE INTERESSANT LA DEFENSE DU TERRITOIRE OU LA SURETE DE L'ETAT, 10 JANVIER 1955"
"";"dtu|dtupub";"";"2022-01-06T04:59:53.990Z";"DEGENNE, Alain";"";"2520171631";"";"";"1993";"";"";"";"";"article";"dtu_external|dtupub_external";"";"";"";"";"";"";"430-434";"";"L'annã©e Sociologique (1940/1948-)|L'année Sociologique|Annee Sociol|Année Sociologique|Lannee Sociologique";"Annee Sociol|Année Sociologique|L'annã©e Sociologique (1940/1948-)|L'année Sociologique|Lannee Sociologique";"00662399|000106|000043|000000|000000";"43";"";"";"";"";"fre";"5d7e476bd9001d01b8c886eb";"";"5d7e476bd9001d01b8c886eb";"Presses Universitaires de France";"jstor";"jstor";"Sociométrie, réseaux et communication"
"";"dtu|dtupub";"";"2022-01-06T05:02:14.262Z";"AUBREY, ROGER F.";"";"2461130794";"";"";"1972";"";"";"";"";"article";"dtu_external|dtupub_external";"";"";"";"2";"";"";"90-97";"";"Elementary School Guidance and Counseling|Elementary School Guidance and Counseling|Elementary School Guidance and Counseling";"Elementary School Guidance and Counseling";"00135976|000127|000007|000002|000000";"7";"";"";"";"";"eng";"5d7e47c3d9001d01b8c8a1ee";"";"5d7e47c3d9001d01b8c8a1ee";"American School Counselor Association";"jstor";"jstor";"Power bases: The consultant's vehicle for change"
"";"dtu|dtupub";"";"2022-01-05T11:16:34.091Z";"de Lara, Philippe";"";"2477238596";"";"";"1992";"";"";"";"";"article";"dtu_external|dtupub_external";"";"";"";"183 (7)";"";"";"162-164";"";"Esprit (1940-)|Esprit";"Esprit|Esprit (1940-)";"00140759|000107|000000|000183|000000";"";"";"";"";"";"fre";"5d7e41f6d9001d01b8c6e285";"";"5d7e41f6d9001d01b8c6e285";"Esprit";"jstor";"jstor";"LES GENS DE PEU, coll. « Sociologie d'aujourd'hui »"
"";"dtu|dtupub";"";"2022-01-06T04:24:51.108Z";"Schlegel, Jean-louis";"";"2520122695";"";"";"1999";"";"";"";"";"article";"dtu_external|dtupub_external";"";"";"";"252 (5)";"";"";"240-240";"";"Esprit (1940-)|Esprit";"Esprit|Esprit (1940-)";"00140759|000100|000000|000252|000000";"";"";"";"";"";"fre";"5d7e3b77d9001d01b8c4ef3d";"";"5d7e3b77d9001d01b8c4ef3d";"Esprit";"jstor";"jstor";"LES CATHOLIQUES DANS LA GUERRE. 1939-1945, coll. « La vie quotidienne »"
"";"dtu|dtupub";"";"2022-01-05T11:49:03.367Z";"USHER, G. A.";"";"2520212003";"";"";"1964";"";"";"";"";"article";"dtu_external|dtupub_external";"";"";"";"166";"";"";"214-215";"";"History|History|History (lond)|History London|History the Journal of the Historical Association";"History|History (lond)|History London|History the Journal of the Historical Association";"00182648|000135|000049|000166|000000";"49";"";"";"";"";"eng";"5d7e50b3d9001d01b8cb5b34";"";"5d7e50b3d9001d01b8cb5b34";"Routledge and Kegan Paul";"jstor";"jstor";"J. LE NEVE: FASTI ECCLESIAE ANGLICANAE, 1300–1541: i, DIOCESE OF LINCOLN, DIOCESE OF HEREFORD, DIOCESE OF SALISBURY, MONASTIC CATHEDRAL"
"Logical reasoning, guided by existing literature is used, as opposed to a purely mathematical procedure, to explore factors related to infant and child mortality in Ghana. The decision to use this approach arises from the limitations of such conventional approaches as stepwise regression models. We found no relationship between infant and child mortality and partner's occupation, maternal age at first birth and birth order. However, respondent's education, residence, childhood place of residence, ethnicity, religion and birth order all showed considerable relationship with infant and child mortality when considered individually, although the significance of the latter set of variables was reduced considerably once the effect of region was considered.";"dtu|dtupub";"";"2022-01-05T18:36:38.013Z";"Amoateng, Acheampong Yaw|Kalule-Sabiti, Ishmael";"";"2460993273";"";"";"2013";"";"";"";"";"article";"dtu_external|dtupub_external";"";"";"";"1";"";"";"58-81";"";"Southern African Journal of Demography";"Southern African Journal of Demography";"16824482|000086|000014|000001|000000";"14";"";"Infant and child mortality|breastfeeding|demographic and health survey|generalized logit models|globalization|household amenities|logistic regression|maternal education|proportional odds model|toilet facilities";"Infant and child mortality|breastfeeding|demographic and health survey|generalized logit models|globalization|household amenities|logistic regression|maternal education|proportional odds model|toilet facilities";"Infant and child mortality|breastfeeding|demographic and health survey|generalized logit models|globalization|household amenities|logistic regression|maternal education|proportional odds model|toilet facilities";"eng";"5d7e3c20d9001d01b8c5204f";"";"5d7e3c20d9001d01b8c5204f";"Population Association of Southern Africa";"jstor";"jstor";"Exploring Factors Related to Infant and Child Mortality in Ghana Using the 2003 Demographic and Health Survey Data"
"";"dtu|dtupub";"";"2022-01-06T10:37:12.263Z";"Anderson, Gordon L.";"";"2461028284";"";"";"2010";"";"";"";"";"other";"dtu_external|dtupub_external";"";"";"";"2";"";"";"3-6";"";"International Journal on World Peace";"International Journal on World Peace";"";"27";"";"";"";"";"eng";"5d7e3f16d9001d01b8c6059c";"";"5d7e3f16d9001d01b8c6059c";"Professors World Peace Academy";"jstor";"jstor";"FROM THE EDITOR: RESOLVING ETHNIC CONFLICTS IN NATION-STATES"
"";"dtu|dtupub";"";"2022-01-05T11:53:29.484Z";"ralph, laurence";"";"2461251515";"";"dtu";"2015";"";"";"";"";"article";"dtu|dtu_electronic|dtupub_external";"";"";"";"3";"";"";"16-17";"";"Contexts|Contexts|Contexts";"Contexts";"15365042|000084|000014|000003|000000";"14";"";"";"";"";"eng";"5d7e5161d9001d01b8cb9377";"";"5d7e5161d9001d01b8cb9377";"American Sociological Association";"jstor";"jstor";"the secret of the blue light"
"";"dtu|dtupub";"";"2022-01-06T04:22:21.385Z";"O’Brien, Rachel";"";"2460978996";"";"dtu";"2016";"";"";"";"";"article";"dtu|dtu_electronic|dtupub|dtupub_electronic";"";"";"";"5566";"";"";"10-15";"";"Rsa Journal|Rsa Journal";"Rsa Journal";"09580433|000083|000162|005566|000000";"162";"";"";"";"";"eng";"5d7e3af3d9001d01b8c4c604";"";"5d7e3af3d9001d01b8c4c604";"Wardour";"jstor";"jstor";"REFORMING GOALS"
"The purpose of the paper is to present a general description of contemporary life for rural Egyptian women and to analyze factors within the culture that influence their roles and status. Based on data obtained from a pilot study, as well as on readings, personal observations and conversations with native Egyptians, the paper addresses rural women's familial roles, educational status, employment status and health problems. Note is made of the strong cultural traditions and religious beliefs that often take precedence over women's legal rights. Ways of meeting the needs of rural Egyptian women through technology, education, employment and health services are discussed.";"dtu|dtupub";"";"2022-01-06T04:28:02.538Z";"DICKERSCHEID, JEAN D.";"";"2460992514";"";"";"1990";"";"";"";"";"article";"dtu_external|dtupub_external";"";"";"";"1";"";"";"1-20";"";"International Journal of Sociology of the Family|International Journal of Sociology of the Family|Int J Sociol Fam|International Journal of Sociology of the Family Journal of Cross National Cr";"Int J Sociol Fam|International Journal of Sociology of the Family|International Journal of Sociology of the Family Journal of Cross National Cr";"00207667|000109|000020|000001|000000";"20";"";"";"";"";"eng";"5d7e3c14d9001d01b8c51cb1";"";"5d7e3c14d9001d01b8c51cb1";"Prints India";"jstor";"jstor";"PROFILES OF RURAL EGYPTIAN WOMEN: RULES, STATUS AND NEEDS"
"Telmatobius carrillae Morales, 1988, is a riparian frog inhabiting an altitudinal range of 3,680-4,718 m asi in the Central Peruvian Andes. Snout-vent length at metamorphosis is 21.6 mm; minimum size at maturity is 35.3 mm in males and 40.0 mm in females; and maximum size recorded 53.5 mm and 60 mm, respectively. Variation in size is accounted for by pronounced sexual size dimorphism and sex-independent increase in size along an altitudinal gradient (Bergmann cline). Dorsal and ventral color pattern varies considerably from locality to locality rendering this character unreliable for species diagnosis. Most skin features (e.g., width of skin layers, gland size and frequency) showed a considerable range of covariation with ontogenetic stage, sex, and SVL. The absence of serous glands with large granules, a character state shared with Batrachophrynus spp., is confirmed for T. carrillae. However, analysis of the altitudinal ranges of telmatobiine frogs with and without serous glands with large granules suggests that the apparent synapomorphy of Batrachophrynus spp., and T. carrillae may alternatively constitute a response to the ecological demands of high-altitude habitats rather than a phylogenetic signal.";"dtupub";"";"2022-01-11T13:12:55.290Z";"Sinsch, Ulrich|Lehr, Edgar";"";"2875069448";"";"dtu";"2010";"";"10.1670/09-081.1";"";"";"article";"dtu|dtu_electronic|dtupub_external";"";"";"";"4";"";"";"495-505";"";"Journal of Herpetology|Journal of Herpetology|Journal of Herpetology|J Herpetol|J. Herpetol";"J Herpetol|J. Herpetol|Journal of Herpetology";"00221511|000089|000044|000004|000000";"44";"";"";"";"";"eng";"5d051069d9001d394c3f63d3|5d7e4081d9001d01b8c67496";"";"5d051069d9001d394c3f63d3";"Society for the Study of Amphibians and Reptiles";"crossref|jstor";"crossref|jstor";"Geographical Variation in the High Andean Frog Telmatobius carrillae Morales, 1988 (Ceratophryidae, Telmatobiinae): Size, Skin Texture, and Coloration"
"";"dtu|dtupub";"";"2022-01-06T04:26:57.244Z";"WALSHAM, ALEXANDRA";"";"2477409394";"";"dtu";"2005";"";"";"";"";"article";"dtu|dtu_electronic|dtupub_external";"";"";"";"1 (297)";"";"";"129-130";"";"History|History|History (lond)|History London|History the Journal of the Historical Association";"History|History (lond)|History London|History the Journal of the Historical Association";"00182648|000094|000090|000001|000000";"90";"";"";"";"";"eng";"5d7e3be0d9001d01b8c50da6";"";"5d7e3be0d9001d01b8c50da6";"Blackwell Publishing Ltd.";"jstor";"jstor";"The Trail of Martyrdom: Persecution and Resistance in England"
"";"dtu|dtupub";"";"2022-01-05T10:57:36.134Z";"Musto, Stefan A.";"";"2477388887";"";"";"1979";"";"";"";"";"article";"dtu_external|dtupub_external";"";"";"";"1";"";"";"88-88";"";"Studia Diplomatica|Studia Diplomatica";"Studia Diplomatica";"07702965|000120|000032|000001|000000";"32";"";"";"";"";"fre";"5d7e3729d9001d01b8c3a193";"";"5d7e3729d9001d01b8c3a193";"INSTITUT ROYAL DES RELATIONS INTERNATIONALES / KONINKLIJK INSTITUUT VOOR INTERNATIONALE BETREKKINGEN";"jstor";"jstor";"Spanien und die Europäische Gemeinschaft : Der schwierige Weg zur Mitgliedschaft"
"";"dtu|dtupub";"";"2022-01-06T04:58:31.785Z";"NAMER, Gérard";"";"2461123145";"";"";"1999";"";"";"";"";"article";"dtu_external|dtupub_external";"";"";"";"1";"";"";"223-235";"";"L'annã©e Sociologique (1940/1948-)|L'année Sociologique|Annee Sociol|Année Sociologique|Lannee Sociologique";"Annee Sociol|Année Sociologique|L'annã©e Sociologique (1940/1948-)|L'année Sociologique|Lannee Sociologique";"00662399|000100|000049|000001|000000";"49";"";"";"";"";"fre";"5d7e4722d9001d01b8c8705b";"";"5d7e4722d9001d01b8c8705b";"Presses Universitaires de France";"jstor";"jstor";"LA MÉMOIRE CULTURELLE CHEZ MAURICE HALBWACHS"
"";"dtu|dtupub";"";"2022-01-06T04:45:46.966Z";"BRIDGE, F. R.";"";"2520160180";"";"";"1992";"";"";"";"";"article";"dtu_external|dtupub_external";"";"";"";"250";"";"";"324-326";"";"History|History|History (lond)|History London|History the Journal of the Historical Association";"History|History (lond)|History London|History the Journal of the Historical Association";"00182648|000107|000077|000250|000000";"77";"";"";"";"";"eng";"5d7e44f5d9001d01b8c7c725";"";"5d7e44f5d9001d01b8c7c725";"Blackwell Publishers";"jstor";"jstor";"A System of Ambition? British Foreign Policy, 1660–1793"
"";"dtu|dtupub";"";"2022-01-06T04:12:24.005Z";"BURK, KATHLEEN";"";"2520108879";"";"";"1986";"";"";"";"";"article";"dtu_external|dtupub_external";"";"";"";"232";"";"";"364-365";"";"History|History|History (lond)|History London|History the Journal of the Historical Association";"History|History (lond)|History London|History the Journal of the Historical Association";"00182648|000113|000071|000232|000000";"71";"";"";"";"";"eng";"5d7e368fd9001d01b8c37313";"";"5d7e368fd9001d01b8c37313";"The Historical Association";"jstor";"jstor";"A MAN AND AN INSTITUTION: SIR MAURICE HANKEY, THE CABINET SECRETARIAT AND THE CUSTODY OF CABINET SECRECY"
"";"dtupub";"";"2022-01-05T02:59:52.361Z";"Larson, Mark";"";"2688250116";"";"";"2001";"";"";"";"";"article";"dtu_external|dtupub_external";"";"";"";"2";"";"";"146-152";"";"English Education|English Education|Engl Educ";"Engl Educ|English Education";"00078204|000098|000033|000002|000000";"33";"";"";"";"";"eng";"5d7d28a7d9001d01b87465bd";"";"5d7d28a7d9001d01b87465bd";"National Council of Teachers of English";"jstor";"jstor";"Starting from Scratch"
"";"dtu|dtupub";"";"2022-01-06T23:30:49.485Z";"Smith,, Wm. Reece";"";"2460960969";"";"";"1969";"";"";"";"";"other";"dtu_external|dtupub_external";"";"";"";"5";"";"";"443-443";"";"American Bar Association Journal";"American Bar Association Journal";"";"55";"";"";"";"";"eng";"5d7e397dd9001d01b8c4538b";"";"5d7e397dd9001d01b8c4538b";"American Bar Association";"jstor";"jstor";"Notice by the Secretary of the American Bar Association"
"";"dtu|dtupub";"";"2022-01-06T23:32:20.506Z";"Abádi-Nagy, Zoltán";"";"2460993753";"";"";"1991";"";"";"";"";"other";"dtu_external|dtupub_external";"";"";"";"";"";"";"7-8";"";"Hungarian Studies in English";"Hungarian Studies in English";"";"22";"";"";"";"";"eng";"5d7e3c36d9001d01b8c526bf";"";"5d7e3c36d9001d01b8c526bf";"Institute of English and American Studies, Lajos Kossuth University";"jstor";"jstor";"EDITORIAL NOTE"
"";"dtu|dtupub";"";"2022-01-06T05:00:22.002Z";"CHANNON, GEOFFREY";"";"2477261059";"";"";"1985";"";"";"";"";"article";"dtu_external|dtupub_external";"";"";"";"229";"";"";"341-342";"";"History|History|History (lond)|History London|History the Journal of the Historical Association";"History|History (lond)|History London|History the Journal of the Historical Association";"00182648|000114|000070|000229|000000";"70";"";"";"";"";"eng";"5d7e4794d9001d01b8c8939b";"";"5d7e4794d9001d01b8c8939b";"GEORGE PHILIP AND SON, LIMITED";"jstor";"jstor";"GREENE KING: A BUSINESS AND FAMILY HISTORY"
"";"dtu|dtupub";"";"2022-01-05T07:03:30.570Z";"Jordan, June";"";"2405426353";"";"dtu";"1986";"";"10.2307/2930659";"";"";"article";"dtu|dtu_electronic|dtupub_external";"";"";"";"27";"";"";"341";"";"Callaloo|Callaloo|Callaloo|Callaloo a Journal of African American and African Arts and Letters";"Callaloo|Callaloo a Journal of African American and African Arts and Letters";"01612492|000113|000000|000027|000000";"";"";"";"";"";"und";"56d788845b3804ae4202345f|5cbf56b5d9001d62a21cfd04";"";"5cbf56b5d9001d62a21cfd04";"Johns Hopkins University Press";"jstor|crossref";"jstor|crossref";"Poem for Buddy: Dedicated to Andre Morgan 3/29/86"
"";"dtu|dtupub";"";"2022-01-06T05:06:27.262Z";"McMAHON, D. A.";"";"2477264809";"";"";"1981";"";"";"";"";"article";"dtu_external|dtupub_external";"";"";"";"217";"";"";"353-353";"";"History|History|History (lond)|History London|History the Journal of the Historical Association";"History|History (lond)|History London|History the Journal of the Historical Association";"00182648|000118|000066|000217|000000";"66";"";"";"";"";"eng";"5d7e4875d9001d01b8c8d8e9";"";"5d7e4875d9001d01b8c8d8e9";"The Historical Association";"jstor";"jstor";"THE IRISH DEPARTMENT OF FINANCE, 1922–58"
"";"dtu|dtupub";"";"2022-01-06T04:57:30.489Z";"";"";"2461122078";"";"dtu";"2007";"";"";"";"";"article";"dtu|dtu_electronic|dtupub|dtupub_electronic";"";"";"";"";"";"";"301-306";"";"Proceedings. Annual Conference on Taxation and Minutes of the Annual Meeting of the National Tax Association|Proceedings. Annual Conference on Taxation and Minutes of the Annual Meeting of the National Tax Association|Proceedings ... Annual Conference on Taxation ... and Minutes of the Annual Meeting of the National Tax Association";"Proceedings ... Annual Conference on Taxation ... and Minutes of the Annual Meeting of the National Tax Association|Proceedings. Annual Conference on Taxation and Minutes of the Annual Meeting of the National Tax Association";"15497542|000092|000100|000000|000000";"100";"";"";"";"";"eng";"5d7e470cd9001d01b8c869b4";"";"5d7e470cd9001d01b8c869b4";"National Tax Association";"jstor";"jstor";"Here Today, Gone Tomorrow: Income Taxation of Cash Flow Reversals"
"";"dtu|dtupub";"";"2022-01-06T23:36:24.585Z";"";"";"2461138903";"";"";"1987";"";"";"";"";"other";"dtu_external|dtupub_external";"";"";"";"3";"";"";"";"";"Anthropologischer Anzeiger";"Anthropologischer Anzeiger";"";"45";"";"";"";"";"ger";"5d7e486ed9001d01b8c8d6c7";"";"5d7e486ed9001d01b8c8d6c7";"E. Schweizerbart'sche Verlagsbuchhandlung";"jstor";"jstor";"Back Matter"
"";"dtu|dtupub";"Dartmouth College";"2022-01-03T13:36:22.558Z";"CHAUDHURI, PRAMIT";"";"2518086512";"";"dtu";"2012";"";"10.1017/S0009838811000437";"";"";"article";"dtu|dtu_electronic|dtupub_external";"";"";"";"1";"";"";"223-226";"";"Classical Quarterly|Classical Quarterly|Class. Q|Class Q|Classical Quart|Classical Quarterly|Classical Quarterly";"Class Q|Class. Q|Classical Quart|Classical Quarterly";"00098388|000087|000062|000001|000000";"62";"";"";"";"";"und";"575e88bb099354424900efb4";"";"575e88bb099354424900efb4";"Cambridge University Press";"cup";"cup";"NAMING NEFAS: CLEOPATRA ON THE SHIELD OF AENEAS1"
"";"dtu|dtupub";"";"2022-01-06T05:10:52.867Z";"Appleson, Gail";"";"2461173539";"";"dtu";"1981";"";"";"";"";"article";"dtu|dtu_electronic|dtupub_external";"";"";"";"10";"";"";"1255-1256";"";"American Bar Association Journal|American Bar Association Journal|Am Bar Assoc J";"Am Bar Assoc J|American Bar Association Journal";"00027596|000118|000067|000010|000000";"67";"";"";"";"";"eng";"5d7e4b4dd9001d01b8c9b698";"";"5d7e4b4dd9001d01b8c9b698";"American Bar Association";"jstor";"jstor";"Punishing Handicapped: Can Schools Expel?"
"";"dtu|dtupub";"";"2022-01-06T10:36:55.477Z";"";"";"2461022043";"";"";"1972";"";"";"";"";"other";"dtu_external|dtupub_external";"";"";"";"4";"";"";"";"";"American Bar Association Journal";"American Bar Association Journal";"";"58";"";"";"";"";"eng";"5d7e3e92d9001d01b8c5ddf8";"";"5d7e3e92d9001d01b8c5ddf8";"American Bar Association";"jstor";"jstor";"Back Matter"
"";"dtu|dtupub";"";"2022-01-05T11:09:08.274Z";"Nagy, Agnès Nemes";"";"2461050699";"";"";"1970";"";"";"";"";"article";"dtu_external|dtupub_external";"";"";"";"398 (12)";"";"";"872-872";"";"Esprit (1940-)|Esprit";"Esprit|Esprit (1940-)";"00140759|000129|000000|000398|000000";"";"";"";"";"";"fre";"5d7e40f9d9001d01b8c698f9";"";"5d7e40f9d9001d01b8c698f9";"Esprit";"jstor";"jstor";"ARBRE"
"";"dtu|dtupub";"";"2022-01-06T10:32:30.829Z";"";"";"2460939368";"";"";"1980";"";"";"";"";"other";"dtu_external|dtupub_external";"";"";"";"33";"";"";"58-59";"";"Science, Technology, and Human Values";"Science, Technology, and Human Values";"";"6";"";"";"";"";"eng";"5d7e37a7d9001d01b8c3c751";"";"5d7e37a7d9001d01b8c3c751";"MIT Press";"jstor";"jstor";"Awards: ""Ethics in Science, Engineering and Medicine"" Awards by NSF and NEH"
"";"dtu|dtupub";"";"2022-01-05T22:58:00.930Z";"ROIG, Charles";"";"2460882027";"";"";"1988";"";"";"";"";"article";"dtu_external|dtupub_external";"";"";"";"";"";"";"235-273";"";"L'annã©e Sociologique (1940/1948-)|L'année Sociologique|Annee Sociol|Année Sociologique|Lannee Sociologique";"Annee Sociol|Année Sociologique|L'annã©e Sociologique (1940/1948-)|L'année Sociologique|Lannee Sociologique";"00662399|000111|000038|000000|000000";"38";"";"";"";"";"fre";"5d7e32c3d9001d01b8c25239";"";"5d7e32c3d9001d01b8c25239";"Presses Universitaires de France";"jstor";"jstor";"PROBABILITÉ, SIGNIFICATION ET CONNAISSANCE SOCIOPOLITIQUE"
"";"dtu|dtupub";"";"2022-01-05T11:09:24.639Z";"שלום, בנימין איש|Ish-Shalom, Benjamin";"";"2461051972";"";"dtu";"1998";"";"";"";"";"article";"dtu|dtu_electronic|dtupub|dtupub_electronic";"";"";"";"90";"";"";"145-149";"";"Cathedra: for the History of Eretz Israel and Its Yishuv / ×§×ª××¨×: ××ª×××××ª ××¨×\xa5 ישראל ויישובה|Cathedra: for the History of Eretz Israel and Its Yishuv / קתדרה: לתולדות ארץ ישראל ויישובה|Cathedra";"Cathedra|Cathedra: for the History of Eretz Israel and Its Yishuv / ×§×ª××¨×: ××ª×××××ª ××¨×\xa5 ישראל ויישובה|Cathedra: for the History of Eretz Israel and Its Yishuv / קתדרה: לתולדות ארץ ישראל ויישובה";"03344657|000101|000000|000090|000000";"";"";"";"";"";"heb";"5d7e411cd9001d01b8c6a1c8";"";"5d7e411cd9001d01b8c6a1c8";"יד יצחק בן-צבי";"jstor";"jstor";"Religious Zionism between Apology and Confrontation / ציונות דתית בין אפולוגיה להתמודדות"
"";"dtu|dtupub";"";"2022-01-06T04:18:31.388Z";"Peterson, Jerry G.|Young,, Malcolm D.";"";"2460972361";"";"";"1974";"";"";"";"";"article";"dtu_external|dtupub_external";"";"";"";"5";"";"";"614-617";"";"American Bar Association Journal|American Bar Association Journal|Am Bar Assoc J";"Am Bar Assoc J|American Bar Association Journal";"00027596|000125|000060|000005|000000";"60";"";"";"";"";"eng";"5d7e3a66d9001d01b8c49b27";"";"5d7e3a66d9001d01b8c49b27";"American Bar Association";"jstor";"jstor";"Using a Word Processing System in a Small Firm"
"";"dtu|dtupub";"";"2022-01-05T11:29:01.962Z";"Liu, Yi-Ching|Baker, Stanley B.";"";"2461150080";"";"";"1993";"";"";"";"";"article";"dtu_external|dtupub_external";"";"";"";"2";"";"";"92-103";"";"Elementary School Guidance and Counseling|Elementary School Guidance and Counseling|Elementary School Guidance and Counseling";"Elementary School Guidance and Counseling";"00135976|000106|000028|000002|000000";"28";"";"";"";"";"eng";"5d7e495ad9001d01b8c91ef0";"";"5d7e495ad9001d01b8c91ef0";"American School Counselor Association";"jstor";"jstor";"enhancing cultural adaptation through friendship training: a single-case study"
