"abstract_ts";"access_ss";"Affiliations";"Timestamp";"Author";"citation_count_i";"ID";"dtu_library_collection_facet";"collection_facet";"Publication Year";"Conference";"DOI";"Editor";"embargo_ssf";"format";"fulltext_availability_facet";"has_openaccess_fulltext_b";"holdings_ssf";"ISBN";"Journal Issue";"journal_issue_tsort";"journal_oa_model_ss";"Journal Page";"journal_page_start_tsort";"Journal Title";"journal_title_facet";"toc_key_s";"Journal Volume";"journal_vol_tsort";"keywords_ts";"keywords_facet";"keywords_normalized";"isolanguage_facet";"member_id_ss";"ORCID";"primary_member_id_s";"Publisher";"Source";"source_all_ss";"Title"
"The communication program of the Los Angeles Department of Water and Power (LADWP) has been largely informational—messages have historically been passed from the utility to the public without citizens being involved in any substantive way in decisions about water quality issues. In 1985, however, when LADWP made plans to construct an aeration tower to strip contaminants from groundwater without notifying the community in the immediate vicinity of the proposed site, there was a public outcry. Many lessons were learned from this experience, including the importance of public participation in the early planning stages of a project, the advantages of providing as much information as possible to the public, and the recognition that risk judgments are often based on factors other than the degree of hazard. Históricamente, el programa de comunicación del Departamento de Agua y Energía de Los Angeles (LADWP) ha sido principalmente de tipo informativo, a través de mensajes de las compañías al público, sin que los ciudadanos hayan estado envueltos en una forma importante en la toma de decisiones en los problemas de calidad de aguas. Sin embargo, en 1985, cuando LADWP hizo planes de construir una torre de aireación para quitar contaminantes de aguas subterráneas, sin notificar a la comunidad vecina al sitio propuesto, hubo un gran clamor del público. Muchas lecciones se aprendieron de esta experiencia, incluyendo entre otras la importancia de la participación del público en las etapas preliminares de la planeación de un proyecto, las ventajas de dar la mayor cantidad de información posible al público, y el reconocimiento de que evaluaciones de riesgo estén a menudo basados en otros factores fuera del grado de riesgo.";"dtu|dtupub";"";"2022-01-10T05:53:57.806Z";"Shovlin, Marjorie G.|Tanaka, Sandra S.";"";"2691202800";"";"";"1990";"";"10.1002/j.1551-8833.1990.tb07050.x";"";"";"article";"dtu_printed|dtupub_printed";"";"";"";"11";"";"";"40-44";"";"Journal Awwa|Journal Awwa|Journal Awwa|Am Water Works Assoc J|J Am Water|J Am Water Work Assoc|J Am Water Works Ass|J Am Water Works Assoc|J Amer Water Work Assn|J. Am. Water Works Assn|Journal|Journal American Water Works Association|Journal of the American Water Works Association";"Am Water Works Assoc J|J Am Water|J Am Water Work Assoc|J Am Water Works Ass|J Am Water Works Assoc|J Amer Water Work Assn|J. Am. Water Works Assn|Journal|Journal American Water Works Association|Journal Awwa|Journal of the American Water Works Association";"0003150x|000109|000082|000011|000000";"82";"";"";"";"";"eng";"5cc181fed9001d62a271b68a|5d7db394d9001d01b89f5622";"";"5cc181fed9001d62a271b68a";"American Water Works Association";"crossref|jstor";"crossref|jstor";"Risk Communication in Los Angeles: A Case Study"
"A survey of rural drinking water sources in Chesterfield County, S. C., was conducted to evaluate the inorganic contaminants in these supplies. Results of chemical, physical, and statistical analyses performed showed that many people were using water contaminated from several possible sources.";"dtupub";"";"2022-01-05T12:08:00.475Z";"Sandhu, Shingara S.|Warren, William J.|Nelson, Peter";"";"176426250";"";"";"1977";"";"10.1002/j.1551-8833.1977.tb06720.x";"";"";"article";"dtu_printed|dtupub_printed";"";"";"";"4";"";"";"219-222";"";"Journal Awwa|Journal Awwa|Journal Awwa|Am Water Works Assoc J|J Am Water|J Am Water Work Assoc|J Am Water Works Ass|J Am Water Works Assoc|J Amer Water Work Assn|J. Am. Water Works Assn|Journal|Journal American Water Works Association|Journal of the American Water Works Association";"Am Water Works Assoc J|J Am Water|J Am Water Work Assoc|J Am Water Works Ass|J Am Water Works Assoc|J Amer Water Work Assn|J. Am. Water Works Assn|Journal|Journal American Water Works Association|Journal Awwa|Journal of the American Water Works Association";"0003150x|000122|000069|000004|000000";"69";"";"";"";"";"eng";"5d7daee6d9001d01b89df2d5|5cc181f0d9001d62a271b3d5";"";"5cc181f0d9001d62a271b3d5";"American Water Works Association";"jstor|crossref";"jstor|crossref";"Inorganic Contaminants in Rural Drinking Waters"
"Avian pox virus (Poxvirus avium) is a mosquito-borne disease that occurs worldwide in a variety of bird species, but little is known about its prevalence or effect on seabirds. We monitored prevalence of pox virus and its effect on fledging success of Laysan Albatross (Phoebastria immutabilis) on Oahu, Hawaii, from 2003 to 2007. Pox prevalence in albatross chicks averaged 88% in years with high rainfall and 3% in years with low rainfall. Diagnosis of pox virus was clinically confirmed in two birds by Muscovy Duck (Cairina moschata) fibrolast cultures. Severity of infection ranged from small wart-like nodules and lesions on the bill, face, eyes, tarsus, and feet, to large tumorous growths that completely covered both eyes and caused deformation of the bill and skull. Most chicks recovered from infection, and the fledging rate in pox epizootic years (82%) did not differ from that in years with low pox prevalence (80%) or the average fledging rate on Midway Atoll (86%). Three chicks with severe infections were resighted as healthy adults on Kauai and Oahu in 2007, confirming postfledging survival of at least some birds. The high recovery rate, fledging success, and postfledging survival indicate that Laysan Albatross have strong immunity to avian pox virus. /// La viruela aviar (Poxvirus avium) es una enfermedad que afecta muchas especies de aves a nivel mundial. La enfermedad es transmitida por mosquitos y se sabe poco de su prevalencia y efecto en aves acuáticas. Monitoreamos la prevalencia de este virus y su efecto en volantones de albatros (Phoebastria immutabilis) en Oahu, Hawaii, en trabajo que se llevo a cabo desde el 2003–2007. Encontramos una prevalencia de 88% en pichones de albatros en años lluviosos y de 3% en años de poca lluvia. Se diagnosticó el virus, clínicamente, en dos patos comunes (Cairina moschata) mediante la técnica de cultivo fibroblástico. La severidad de la infección varió desde leve con algunas lesiones en el pico, cara, ojos, tarso y patas, hasta casos severos con grandes tumores que cubrían los ojos y causaron malformación de pico y craneo. La mayoría de los pichones se recobraron de la infección. La tasa de pichones que dejaron el nido (82%) en años de alta incidencia (82%) fue similar (80%) a los años de pocas infecciones y al promedio de volantones (86%) en el Atolón de Midway. Tres individuos observados como pichones con infecciones severas fueron avistados posteriormente como adultos saludables en Kauai y Oahu en el 2007, lo que confirma la sobrevivencia post-volanton de al menos algunas aves. La tasa tan alta de recobro, éxito en dejar el nido y sobrevivencia post-volantón indican que en el Albatros de Laysan hay una alta inmunidad hacia la viruela aviar.";"dtupub";"";"2022-01-05T00:02:28.969Z";"Young, Lindsay C.|VanderWerf, Eric A.";"";"2577245869";"";"dtu";"2008";"";"10.1111/j.1557-9263.2008.00149.x";"";"";"article";"dtu|dtu_electronic|dtupub_external";"";"";"";"1";"";"";"93-98";"";"Journal of Field Ornithology|Journal of Field Ornithology|J Field Ornithology|J Field Orn|J Field Ornithol|J. Field Ornithol";"J Field Orn|J Field Ornithol|J Field Ornithology|J. Field Ornithol|Journal of Field Ornithology";"02738570|000091|000079|000001|000000";"79";"";"Hawaii|Laysan Albatross|avian disease|pox virus|seabirds";"Hawaii|Laysan Albatross|avian disease|pox virus|seabirds";"Hawaii|Laysan Albatross|avian disease|pox virus|seabirds";"eng";"5c5ecd74d9001d01b714ad81|5d7da208d9001d01b89a2985";"";"5c5ecd74d9001d01b714ad81";"Blackwell Publishing";"crossref|jstor";"crossref|jstor";"Prevalence of avian pox virus and effect on the fledging success of Laysan Albatross"
"";"dtu|dtupub";"";"2022-01-08T16:17:44.669Z";"Miller, Margaret";"";"2420013270";"";"";"1956";"";"10.2307/2606356";"";"";"article";"dtu_external|dtupub_external";"";"";"";"4";"";"";"504-505";"";"International Affairs|International Affairs|Int Aff|Int. Aff|International Affairs Oxford";"Int Aff|Int. Aff|International Affairs|International Affairs Oxford";"00205850|000143|000032|000004|000000";"32";"";"";"";"";"eng";"5cb9ccf7d9001d01a41cd497|56d875647af25bcf4212294b";"";"5cb9ccf7d9001d01a41cd497";"Royal Institute of International Affairs";"crossref|jstor";"crossref|jstor";"The Northern Sea Route and the Economy of the Soviet North"
"";"dtu|dtupub";"";"2022-01-05T06:02:51.560Z";"";"";"2458663921";"";"dtu";"2009";"";"";"";"";"article";"dtu|dtu_electronic|dtupub|dtupub_electronic";"";"";"";"";"";"";"19-20";"";"American Libraries|American Libraries|Am Libr";"Am Libr|American Libraries";"00029769|000090|000000|000000|000000";"";"";"";"";"";"eng";"5d7d9fbdd9001d01b8997ae3";"";"5d7d9fbdd9001d01b8997ae3";"American Library Association (ALA)";"jstor";"jstor";"ALA Graphics"
"";"dtu|dtupub";"";"2022-01-06T08:43:39.249Z";"";"";"2458798880";"";"dtu";"1990";"";"";"";"";"other";"dtu|dtu_electronic|dtupub|dtupub_electronic";"";"";"";"7";"";"";"1005-1005";"";"Bulletin of the American Meteorological Society";"Bulletin of the American Meteorological Society";"";"71";"";"";"";"";"eng";"5d7da80cd9001d01b89beee6";"";"5d7da80cd9001d01b89beee6";"American Meteorological Society";"jstor";"jstor";"announcements"
"";"dtu|dtupub";"";"2022-01-06T23:09:33.532Z";"";"";"2459052190";"";"dtu";"2011";"";"";"";"";"other";"dtu|dtu_electronic|dtupub_external";"";"";"";"12";"";"";"8-73";"";"Journal (american Water Works Association)";"Journal (american Water Works Association)";"";"103";"";"";"";"";"eng";"5d7db5edd9001d01b8a00739";"";"5d7db5edd9001d01b8a00739";"American Water Works Association";"jstor";"jstor";"People in the News"
"";"dtu|dtupub";"";"2022-01-06T08:47:23.234Z";"";"";"2458852218";"";"dtu";"2004";"";"";"";"";"other";"dtu|dtu_electronic|dtupub_external";"";"";"";"6";"";"";"";"";"Journal (american Water Works Association)";"Journal (american Water Works Association)";"";"96";"";"";"";"";"eng";"5d7daaf9d9001d01b89cca67";"";"5d7daaf9d9001d01b89cca67";"American Water Works Association";"jstor";"jstor";"Front Matter"
"";"dtupub";"";"2022-01-12T18:14:28.120Z";"Miner, Gary|Wood, Richard";"";"2568765685";"";"dtu";"2007";"";"10.1002/j.1551-8833.2007.tb07978.x";"";"";"article";"dtu|dtu_electronic|dtupub_external";"";"";"";"7";"";"";"38-42";"";"Journal Awwa|Journal Awwa|Journal Awwa|Am Water Works Assoc J|J Am Water|J Am Water Work Assoc|J Am Water Works Ass|J Am Water Works Assoc|J Amer Water Work Assn|J. Am. Water Works Assn|Journal|Journal American Water Works Association|Journal of the American Water Works Association";"Am Water Works Assoc J|J Am Water|J Am Water Work Assoc|J Am Water Works Ass|J Am Water Works Assoc|J Amer Water Work Assn|J. Am. Water Works Assn|Journal|Journal American Water Works Association|Journal Awwa|Journal of the American Water Works Association";"0003150x|000092|000099|000007|000000";"99";"";"";"";"";"eng";"5cc18237d9001d62a271c4fd|5d7db9f0d9001d01b8a132bd";"";"5cc18237d9001d62a271c4fd";"American Water Works Association";"crossref|jstor";"crossref|jstor";"Sun‐ and Wind‐powered Solar Cube Is a Self‐contained Water Purification System"
"This article reviews the historical development of the metric system in Canada and the progress made by the Metric Commission, referring to the proposed timetable for the change. Discussed also is the introduction of metric water meters in the City of Mississauga.";"dtupub";"";"2022-01-05T05:59:35.453Z";"Kennedy, A. P.";"";"2396694281";"";"";"1976";"";"10.1002/j.1551-8833.1976.tb02372.x";"";"";"article";"dtu_printed|dtupub_printed";"";"";"";"3";"";"";"156-158";"";"Journal Awwa|Journal Awwa|Journal Awwa|Am Water Works Assoc J|J Am Water|J Am Water Work Assoc|J Am Water Works Ass|J Am Water Works Assoc|J Amer Water Work Assn|J. Am. Water Works Assn|Journal|Journal American Water Works Association|Journal of the American Water Works Association";"Am Water Works Assoc J|J Am Water|J Am Water Work Assoc|J Am Water Works Ass|J Am Water Works Assoc|J Amer Water Work Assn|J. Am. Water Works Assn|Journal|Journal American Water Works Association|Journal Awwa|Journal of the American Water Works Association";"0003150x|000123|000068|000003|000000";"68";"";"";"";"";"eng";"5d7d9f8ed9001d01b8996cca|5cc181c4d9001d62a271a9d5";"";"5cc181c4d9001d62a271a9d5";"American Water Works Association";"jstor|crossref";"jstor|crossref";"Metrication in Canada"
"An advanced waste-treatment plant operated by the South Lake Tahoe Public Util. Diet, has been conducting research to improve vira I-inactivation processes. More research and professional awareness will be necessary if the industry is to continue improving the design and operation of water-and wastewater-treatment plants for better virus control.";"dtupub";"";"2022-01-11T10:28:34.270Z";"Culp, Russell L.";"";"2396693672";"";"";"1974";"";"10.1002/j.1551-8833.1974.tb02128.x";"";"";"article";"dtu_printed|dtupub_printed";"";"";"";"12";"";"";"699-703";"";"Journal Awwa|Journal Awwa|Journal Awwa|Am Water Works Assoc J|J Am Water|J Am Water Work Assoc|J Am Water Works Ass|J Am Water Works Assoc|J Amer Water Work Assn|J. Am. Water Works Assn|Journal|Journal American Water Works Association|Journal of the American Water Works Association";"Am Water Works Assoc J|J Am Water|J Am Water Work Assoc|J Am Water Works Ass|J Am Water Works Assoc|J Amer Water Work Assn|J. Am. Water Works Assn|Journal|Journal American Water Works Association|Journal Awwa|Journal of the American Water Works Association";"0003150x|000125|000066|000012|000000";"66";"";"";"";"";"eng";"5d7db15bd9001d01b89eabbe|5cc181bdd9001d62a271a7eb";"";"5cc181bdd9001d62a271a7eb";"American Water Works Association";"jstor|crossref";"jstor|crossref";"Breakpoint Chlorination for Virus Inactivation"
"";"dtu|dtupub";"California State Univesity, Long Beach";"2022-01-03T13:34:28.157Z";"Wallsten, Kevin";"";"2855602254";"";"dtu";"2010";"";"10.1017/S0008423910990859";"";"";"article";"dtu|dtu_electronic|dtupub_external";"";"";"";"1";"";"";"226-227";"";"Canadian Journal of Political Science|Canadian Journal of Political Science-revue Canadienne De Science Politique|Can J Pol Sci|Can J Polit Sci|Can J Political Sci|Can. J. Polit. Sci.-rev. Can. Sci. Polit|Canadian Journal of Political Science Revue Canadienne De Science Politique";"Can J Pol Sci|Can J Polit Sci|Can J Political Sci|Can. J. Polit. Sci.-rev. Can. Sci. Polit|Canadian Journal of Political Science|Canadian Journal of Political Science Revue Canadienne De Science Politique|Canadian Journal of Political Science-revue Canadienne De Science Politique";"00084239|000089|000043|000001|000000";"43";"";"";"";"";"und";"575e84380993544249005c89|5cb50228d9001d01a461e9d5";"";"575e84380993544249005c89";"Cambridge University Press";"cup|crossref";"cup|crossref";"Queer Inclusions, Continental Divisions: Public Recognition of Sexual Diversity in Canada and the United States, RaysideDavid, Toronto: University of Toronto Press, 2008, pp. 388"
"";"dtu|dtupub";"";"2022-01-05T11:38:20.821Z";"Wathey, Andrew";"";"2458834992";"";"";"1983";"";"";"";"";"article";"dtu_external|dtupub_external";"";"";"";"1/2";"";"";"58-66";"";"Music and Letters|Music and Letters|Music Lett|Music and Letters";"Music Lett|Music and Letters";"00274224|000116|000064|000001|000000";"64";"";"";"";"";"eng";"5d7daa07d9001d01b89c837d";"";"5d7daa07d9001d01b89c837d";"Oxford University Press";"jstor";"jstor";"Newly Discovered Fifteenth-Century English Polyphony at Oxford"
"";"dtupub";"";"2022-01-12T09:45:04.150Z";"Lee, Kelley";"";"2701683236";"";"dtu";"2012";"";"";"";"";"article";"dtu|dtu_electronic|dtupub_external";"";"";"";"5";"";"";"1132-1133";"";"International Affairs (royal Institute of International Affairs 1944-)|International Affairs|Int Aff|Int. Aff|International Affairs Oxford";"Int Aff|Int. Aff|International Affairs|International Affairs (royal Institute of International Affairs 1944-)|International Affairs Oxford";"00205850|000087|000088|000005|000000";"88";"";"";"";"";"eng";"5d7da83cd9001d01b89bfc8e";"";"5d7da83cd9001d01b89bfc8e";"Blackwell Publishing, Ltd.";"jstor";"jstor";"Global health governance"
"";"dtupub";"";"2022-01-06T00:56:29.623Z";"Warwick, Paul";"";"2722999832";"";"dtu";"2004";"";"10.1017/S0008423904310218";"";"";"article";"dtu|dtu_electronic|dtupub_external";"";"";"";"04";"";"";"1035-1036";"";"Canadian Journal of Political Science/revue Canadienne De Science Politique|Canadian Journal of Political Science-revue Canadienne De Science Politique|Cjp|Can J Polit Sci|Can J Political Sci|Can. J. Polit. Sci.-rev. Can. Sci. Polit|Canadian Journal of Political Science Revue Canadienne De Science Politique";"Can J Polit Sci|Can J Political Sci|Can. J. Polit. Sci.-rev. Can. Sci. Polit|Canadian Journal of Political Science Revue Canadienne De Science Politique|Canadian Journal of Political Science-revue Canadienne De Science Politique|Canadian Journal of Political Science/revue Canadienne De Science Politique|Cjp";"00084239|000095|000037|000004|000000";"37";"";"";"";"";"eng";"5d7dbe77d9001d01b8a286ed|5cb4bb3dd9001d01a4528427";"";"5cb4bb3dd9001d01a4528427";"Cambridge University Press";"jstor|crossref";"jstor|crossref";"The Logic of Political Survival"
"";"dtu|dtupub";"";"2022-01-10T05:54:13.579Z";"STIEGLER, MAYO H.";"";"2396699522";"";"dtu";"2002";"";"10.1002/j.1551-8833.2002.tb09552.x";"";"";"article";"dtu|dtu_electronic|dtupub_external";"";"";"";"10";"";"";"41-41";"";"Journal Awwa|Journal Awwa|Journal Awwa|Am Water Works Assoc J|J Am Water|J Am Water Work Assoc|J Am Water Works Ass|J Am Water Works Assoc|J Amer Water Work Assn|J. Am. Water Works Assn|Journal|Journal American Water Works Association|Journal of the American Water Works Association";"Am Water Works Assoc J|J Am Water|J Am Water Work Assoc|J Am Water Works Ass|J Am Water Works Assoc|J Amer Water Work Assn|J. Am. Water Works Assn|Journal|Journal American Water Works Association|Journal Awwa|Journal of the American Water Works Association";"0003150x|000097|000094|000010|000000";"94";"";"";"";"";"eng";"5cc1821bd9001d62a271bdea|5d7db351d9001d01b89f42e5";"";"5cc1821bd9001d62a271bdea";"American Water Works Association";"crossref|jstor";"crossref|jstor";"Colorado City Enjoined From Expanding Its Use of Water Rights"
"";"dtu|dtupub";"";"2022-01-06T08:47:01.265Z";"";"";"2458845170";"";"";"1961";"";"";"";"";"other";"dtu_printed|dtupub_printed";"";"";"";"10";"";"";"";"";"Journal (american Water Works Association)";"Journal (american Water Works Association)";"";"53";"";"";"";"";"eng";"5d7daa99d9001d01b89cad69";"";"5d7daa99d9001d01b89cad69";"American Water Works Association";"jstor";"jstor";"Front Matter"
"";"dtupub";"";"2022-01-05T11:55:46.148Z";"Borisov, Vasily P.";"";"2434080554";"";"";"2016";"";"";"";"";"article";"dtu_external|dtupub_external";"";"";"";"";"";"";"20-27";"";"Icon|Icon|Icon (lond)";"Icon|Icon (lond)";"13618113|000083|000022|000000|000000";"22";"";"";"";"";"eng";"5d7dad0bd9001d01b89d67d0";"";"5d7dad0bd9001d01b89d67d0";"The International Committee for the History of Technology (ICOHTEC)";"jstor";"jstor";"Technology in Russia: History, Events, Views"
"";"dtu|dtupub";"";"2022-01-06T00:24:08.741Z";"Grunenberg, Antonia";"";"2459100205";"";"";"1997";"";"";"";"";"article";"dtu_external|dtupub_external";"";"";"";"2 (43)";"";"";"76-90";"";"German Politics and Society|German Politics and Society|German Politics and Society";"German Politics and Society";"10450300|000102|000015|000002|000000";"15";"";"";"";"";"eng";"5d7db8a0d9001d01b8a0cffc";"";"5d7db8a0d9001d01b8a0cffc";"Berghahn Books";"jstor";"jstor";"Antitolitarianism Versus Antifascism—Two Legacies of the Past in Germany"
"";"dtu|dtupub";"";"2022-01-06T00:55:43.333Z";"Turvaville, Lester J.";"";"2459202967";"";"";"1959";"";"10.1002/j.1551-8833.1959.tb15777.x";"";"";"article";"dtu_printed|dtupub_printed";"";"";"";"4";"";"";"511-520";"";"Journal - American Water Works Association|Journal Awwa|Journal - American Water Works Association|Am Water Works Assoc J|J Am Water|J Am Water Work Assoc|J Am Water Works Ass|J Am Water Works Assoc|J Amer Water Work Assn|J. Am. Water Works Assn|Journal|Journal American Water Works Association|Journal of the American Water Works Association";"Am Water Works Assoc J|J Am Water|J Am Water Work Assoc|J Am Water Works Ass|J Am Water Works Assoc|J Amer Water Work Assn|J. Am. Water Works Assn|Journal|Journal - American Water Works Association|Journal American Water Works Association|Journal Awwa|Journal of the American Water Works Association";"0003150x|000140|000051|000004|000000";"51";"";"";"";"";"eng";"5d7dbe5ad9001d01b8a27dc9|5cc3b1c9d9001d62a29c9ecf";"";"5cc3b1c9d9001d62a29c9ecf";"American Water Works Association";"jstor|crossref";"jstor|crossref";"Job Evaluation of Water and Sewage Treatment Plants in Florida"
"";"dtu|dtupub";"";"2022-01-06T23:08:32.170Z";"";"";"2459024672";"";"";"1976";"";"";"";"";"other";"dtu_printed|dtupub_printed";"";"";"";"10";"";"";"";"";"Journal (american Water Works Association)";"Journal (american Water Works Association)";"";"68";"";"";"";"";"eng";"5d7db463d9001d01b89f9321";"";"5d7db463d9001d01b89f9321";"American Water Works Association";"jstor";"jstor";"Back Matter"
"After much public debate and education regarding the health and cost aspects of a dual water system, such a system is now operating in Cape Coral, Fla. The authors conceived a plan for a dual water reclamation system for the city in 1981 during a drought in south Florida. They studied the city's 300-mi (480-km) freshwater canal system to determine how much water would be available for a citywide irrigation system that would be supplemented by reuse of wastewater. Test wells were drilled over the 114-sq mi (295-km²) area of Cape Coral to assess the limited supply of treatable potable water for use in all aquifers. In 1992, the first home was connected to the new irrigation supply. About 25 percent of the city is now connected. Cape Coral is the only Florida city that has a detailed utility master plan that includes a citywide nonpotable irrigation system.";"dtu|dtupub";"";"2022-01-06T00:54:35.606Z";"Godman, Robert R.|Kuyk, David D.";"";"2875057345";"";"dtu";"1997";"";"10.1002/j.1551-8833.1997.tb08257.x";"";"";"article";"dtu|dtu_electronic|dtu_printed|dtupub_printed";"";"";"";"7";"";"";"45-53";"";"Journal Awwa|Journal Awwa|Journal Awwa|Am Water Works Assoc J|J Am Water|J Am Water Work Assoc|J Am Water Works Ass|J Am Water Works Assoc|J Amer Water Work Assn|J. Am. Water Works Assn|Journal|Journal American Water Works Association|Journal of the American Water Works Association";"Am Water Works Assoc J|J Am Water|J Am Water Work Assoc|J Am Water Works Ass|J Am Water Works Assoc|J Amer Water Work Assn|J. Am. Water Works Assn|Journal|Journal American Water Works Association|Journal Awwa|Journal of the American Water Works Association";"0003150x|000102|000089|000007|000000";"89";"";"";"";"";"eng";"5d7dbe1ad9001d01b8a26a9c|5cc18204d9001d62a271b809";"";"5cc18204d9001d62a271b809";"American Water Works Association";"jstor|crossref";"jstor|crossref";"A dual water system for Cape Coral"
"";"dtupub";"";"2022-01-10T17:29:04.287Z";"Brown, Alex";"";"2476854198";"";"";"2013";"";"10.1017/S0068113X1300024X";"";"";"article";"dtu_external|dtupub_external";"";"";"";"";"";"";"250-257";"";"Britannia|Britannia|Britannia";"Britannia";"0068113x|000086|000044|000000|000000";"44";"";"";"";"";"eng";"5cb5b00ad9001d01a483b1fb|5d7dada1d9001d01b89d937b";"";"5cb5b00ad9001d01a483b1fb";"Cambridge Univesity Press";"crossref|jstor";"crossref|jstor";"From Iron Age to Early Medieval: Detecting the Ecological Impact of the Romans on the Landscape of South-East Wales"
"";"dtu|dtupub";"";"2022-01-05T06:32:43.289Z";"Chitchaline, Iouri";"";"2458694172";"";"";"1994";"";"";"";"";"article";"dtu_external|dtupub_external";"";"";"";"157";"";"";"57-66";"";"Hermathena|Hermathena";"Hermathena";"00180750|000105|000000|000157|000000";"";"";"";"";"";"fre";"5d7da19ad9001d01b89a0907";"";"5d7da19ad9001d01b89a0907";"Dublin University Press, Trinity College";"jstor";"jstor";"L'Imagination chez Proclus, Porphyre et Erigène"
