"abstract_ts";"access_ss";"Affiliations";"Timestamp";"Author";"citation_count_i";"ID";"dtu_library_collection_facet";"collection_facet";"Publication Year";"Conference";"DOI";"Editor";"embargo_ssf";"format";"fulltext_availability_facet";"has_openaccess_fulltext_b";"holdings_ssf";"ISBN";"Journal Issue";"journal_issue_tsort";"journal_oa_model_ss";"Journal Page";"journal_page_start_tsort";"Journal Title";"journal_title_facet";"toc_key_s";"Journal Volume";"journal_vol_tsort";"keywords_ts";"keywords_facet";"keywords_normalized";"isolanguage_facet";"member_id_ss";"ORCID";"primary_member_id_s";"Publisher";"Source";"source_all_ss";"Title"
"This research examines the integration of medical simulators into medical education. Training on a haptic-enabled surgery simulator has been observed with an eye to the context of the medical apprenticeship. Videotape of simulations and ethnographic observations at the simulator center are analyzed using the theoretical tools of legitimate peripheral practice and identity construction. In doing so, it becomes apparent that simulations are much more than just a forum for the transfer of specific medical skills. Although they may be designed to facilitate discrete aspects of surgical practice, when in use, the simulators are surrounded by the rich and varied social interactions that make up the medical apprenticeship. These social aspects contribute to the creation of medical practices out of simulator practices, so that working on the simulator can still be experienced as part of the situated learning otherwise conducted during the internship (clinical clerkship) of medical training.";"dtupub";"";"2022-01-06T09:47:08.324Z";"Johnson, Ericka Sue";"";"2875069879";"";"dtu";"2008";"";"";"";"";"article";"dtu|dtu_electronic|dtupub_external";"";"";"";"1";"";"";"53-76";"";"Science, Technology, and Human Values|Science Technology and Human Values|Sci Technol Hum Val|Sci Technol Human Values|Sci. Technol. Hum. Values|Science Technology and Human Values";"Sci Technol Hum Val|Sci Technol Human Values|Sci. Technol. Hum. Values|Science Technology and Human Values|Science, Technology, and Human Values";"01622439|000091|000033|000001|000000";"33";"";"Medical simulation|apprenticeship|identity|situated learning|surgical simulator";"Medical simulation|apprenticeship|identity|situated learning|surgical simulator";"Medical simulation|apprenticeship|identity|situated learning|surgical simulator";"eng";"5d7e4acfd9001d01b8c99084";"";"5d7e4acfd9001d01b8c99084";"Sage Publications";"jstor";"jstor";"Out of My Viewfinder, Yet in the Picture: Seeing the Hospital in Medical Simulations"
"";"dtu|dtupub";"";"2022-01-06T23:30:38.069Z";"";"";"2460924514";"";"dtu";"2007";"";"";"";"";"other";"dtu|dtu_electronic|dtupub|dtupub_electronic";"";"";"";"1";"";"";"";"";"L'annã©e Sociologique (1940/1948-)";"L'annã©e Sociologique (1940/1948-)";"";"57";"";"";"";"";"fre";"5d7e3669d9001d01b8c367ae";"";"5d7e3669d9001d01b8c367ae";"Presses Universitaires de France";"jstor";"jstor";"Front Matter"
"";"dtu|dtupub";"";"2022-01-05T23:23:03.757Z";"";"";"2461241948";"";"";"2009";"";"";"";"";"other";"dtu_external|dtupub_external";"";"";"";"355 (6)";"";"";"4-5";"";"Esprit";"Esprit";"";"";"";"";"";"";"fre";"5d7e50e0d9001d01b8cb6905";"";"5d7e50e0d9001d01b8cb6905";"Esprit";"jstor";"jstor";"Éditorial: La crise? Quelle crise? ou comment en sortir si l'on n'y est pas entré?"
"On radio and television we hear many simplistic reasons and answers about the September 11 attacks and what they mean. Simple answers come from President Bush, Osama bin Laden, Rush Limbaugh and Bill O'Reiley, but the world is not that simple. We live in a world that looks unipolar—and American leaders act as if it is—but in fact is multi-polar. This article outlines several examples of ""arrogance of power"" by the United States. This arrogance must be redressed and American leaders must treat others with dignity and respect before we can solve global problems that require mutual cooperation.";"dtu|dtupub";"";"2022-01-05T23:38:29.310Z";"Stover, William James";"";"2460947239";"";"";"2001";"";"";"";"";"article";"dtu_external|dtupub_external";"";"";"";"4";"";"";"63-68";"";"International Journal on World Peace|International Journal on World Peace|Int J World Peace";"Int J World Peace|International Journal on World Peace";"07423640|000098|000018|000004|000000";"18";"";"";"";"";"eng";"5d7e384fd9001d01b8c3f9ca";"";"5d7e384fd9001d01b8c3f9ca";"Professors World Peace Academy";"jstor";"jstor";"AMERICAN LEADERSHIP: DOUBT AND SUSPICION IN THE FACE OF POWER"
"";"dtupub";"";"2022-01-05T11:31:12.847Z";"Buthelezi, Mangosuthu G.";"";"164380742";"";"";"1991";"";"";"";"";"article";"dtu_external|dtupub_external";"";"";"";"1";"";"";"73-79";"";"International Journal on World Peace|International Journal on World Peace|Int J World Peace";"Int J World Peace|International Journal on World Peace";"07423640|000108|000008|000001|000000";"8";"";"";"";"";"eng";"5d7e49c5d9001d01b8c93eb6";"";"5d7e49c5d9001d01b8c93eb6";"Professors World Peace Academy";"jstor";"jstor";"BUTHELEZI: THOUGHTS ON PEACE AND FREEDOM"
"";"dtupub";"";"2022-01-05T11:31:06.821Z";"YORKE, BARBARA";"";"146129571";"";"dtu";"1998";"";"";"";"";"article";"dtu|dtu_electronic|dtupub_external";"";"";"";"272";"";"";"702-702";"";"History|History|History (lond)|History London|History the Journal of the Historical Association";"History|History (lond)|History London|History the Journal of the Historical Association";"00182648|000101|000083|000272|000000";"83";"";"";"";"";"eng";"5d7e49b7d9001d01b8c93ad8";"";"5d7e49b7d9001d01b8c93ad8";"Blackwell Publishers";"jstor";"jstor";"Queen Emma and Queen Edith: Queenship and Women's Power in Eleventh-century England"
"";"dtu|dtupub";"";"2022-01-05T23:15:56.574Z";"Correnti, V.";"";"2461149397";"";"";"1959";"";"";"";"";"other";"dtu_external|dtupub_external";"";"";"";"1";"";"";"88-89";"";"Anthropologischer Anzeiger";"Anthropologischer Anzeiger";"";"23";"";"";"";"";"ger";"5d7e494cd9001d01b8c91a89";"";"5d7e494cd9001d01b8c91a89";"E. Schweizerbart'sche Verlagsbuchhandlung";"jstor";"jstor";"Raffaello Battaglia, 1896–1958"
"";"dtu|dtupub";"";"2022-01-05T11:27:12.251Z";"Makdisi, George";"";"2461147157";"";"";"1957";"";"";"";"";"article";"dtu_external|dtupub_external";"";"";"";"3";"";"";"426-443";"";"Bulletin of the School of Oriental and African Studies, University of London|Bulletin of the School of Oriental and African Studies, University of London|B Sch Orient Afr St|Bull Sch Orient Afr Stud|Bulletin of the School of Oriental and African Studies|University of London School of Oriental and African Studies Bulletin";"B Sch Orient Afr St|Bull Sch Orient Afr Stud|Bulletin of the School of Oriental and African Studies|Bulletin of the School of Oriental and African Studies, University of London|University of London School of Oriental and African Studies Bulletin";"0041977x|000142|000019|000003|000000";"19";"";"";"";"";"ara";"5d7e491ed9001d01b8c90c42";"";"5d7e491ed9001d01b8c90c42";"The School of Oriental and African Studies, University of London";"jstor";"jstor";"Autograph Diary of an Eleventh-Century Historian of Baghdād--V (Concluded)"
"";"dtu|dtupub";"";"2022-01-05T11:26:01.561Z";"St. Wurzinger";"";"2477246439";"";"";"1928";"";"";"";"";"article";"dtu_external|dtupub_external";"";"";"";"3";"";"";"219-219";"";"Anthropologischer Anzeiger|Anthropologischer Anzeiger|Anthropol Anz|Anthropol. Anz";"Anthropol Anz|Anthropol. Anz|Anthropologischer Anzeiger";"00035548|000171|000005|000003|000000";"5";"";"";"";"";"ger";"5d7e436bd9001d01b8c75292";"";"5d7e436bd9001d01b8c75292";"E. Schweizerbart'sche Verlagsbuchhandlung";"jstor";"jstor";"Säuglingssterblichkeit bei Familien verschiedener Volksstämme. Gesundheitsfürsorge f. d. Kindesalter Bd. 3, H. 1"
"";"dtupub";"University of Nevada, Las Vegas";"2022-01-09T13:51:16.315Z";"Brown, Gregory";"";"2398051054";"";"dtu";"2003";"";"10.1086/377754";"";"";"article";"dtu|dtu_electronic|dtupub_external";"";"";"";"1";"";"";"139-141";"";"Journal of Modern History|Journal of Modern History|Journal of Modern History|J Mod Hist|J. Mod. Hist|Journal of Modern History";"J Mod Hist|J. Mod. Hist|Journal of Modern History";"00222801|000096|000075|000001|000000";"75";"";"";"";"";"eng";"5cbe8eacd9001d01a4aa62c7|56d86ae5725f2ebd42112fe7";"";"5cbe8eacd9001d01a4aa62c7";"The University of Chicago Press";"crossref|jstor";"crossref|jstor";"The War for the Public Mind: Political Censorship in Nineteenth‐Century Europe. Edited by Robert Justin Goldstein. Westport, Conn.: Praeger, 2000. Pp. xiii+277. $64.00"
"Ran is a small GTP-binding protein of the Ras superfamily regulating fundamental cellular processes: nucleo-cytoplasmic transport, nuclear envelope formation and mitotic spindle assembly. An intracellular Ran•GTP/Ran•GDP gradient created by the distinct subcellular localization of its regulators RCC1 and RanGAP mediates many of its cellular effects. Recent proteomic screens identified five Ran lysine acetylation sites in human and eleven sites in mouse/rat tissues. Some of these sites are located in functionally highly important regions such as switch I and switch II. Here, we show that lysine acetylation interferes with essential aspects of Ran function: nucleotide exchange and hydrolysis, subcellular Ran localization, GTP hydrolysis, and the interaction with import and export receptors. Deacetylation activity of certain sirtuins was detected for two Ran acetylation sites in vitro. Moreover, Ran was acetylated by CBP/p300 and Tip60 in vitro and on transferase overexpression in vivo. Overall, this study addresses many important challenges of the acetylome field, which will be discussed.";"dtu|dtupub";"";"2022-01-05T14:20:05.895Z";"de Boor, Susanne|Knyphausen, Philipp|Kuhlmann, Nora|Wroblowski, Sarah|Brenig, Julian|Scislowski, Lukas|Baldus, Linda|Nolte, Hendrik|Krüger, Marcus|Lammers, Michael";"";"2724744947";"";"dtu";"2015";"";"10.1073/pnas.1505995112";"";"";"article";"dtu|dtu_electronic|dtupub|dtupub_electronic";"";"";"";"28";"";"";"E3679-E3688";"";"Proceedings of the National Academy of Sciences of the United States of America|Proceedings of the National Academy of Sciences of the United States of America|Proc Natl Acad Sci U S a|National Academy of Sciences of the United States of America Proceedings|P Nas Us|P Natl Acad Sci Usa|Pnas|Proc Nat Acad Sci U S a|Proc Nat Acad Sci Usa|Proc Natl Acad Sci U S a|Proc Natl Acad Sci Usa|Proc. Natl. Acad. Sci. U. S. a|Proceedings of the National Academy of Sciences|Proceedings of the National Academy of Sciences of the United States of Ame|Pronas";"National Academy of Sciences of the United States of America Proceedings|P Nas Us|P Natl Acad Sci Usa|Pnas|Proc Nat Acad Sci U S a|Proc Nat Acad Sci Usa|Proc Natl Acad Sci U S a|Proc Natl Acad Sci Usa|Proc. Natl. Acad. Sci. U. S. a|Proceedings of the National Academy of Sciences|Proceedings of the National Academy of Sciences of the United States of Ame|Proceedings of the National Academy of Sciences of the United States of America|Pronas";"00278424|000084|000112|000028|000000";"112";"";"";"";"";"eng";"56d6e879ebe4a28b760006a3";"";"56d6e879ebe4a28b760006a3";"";"pnas";"pnas";"Small GTP-binding protein Ran is regulated by posttranslational lysine acetylation"
"The floral morphology of Sassafras randaiense (Hayata) Rehder (Lauraceae), a rare species endemic to Taiwan, has never been well documented. Consequently, much confusion exists in taxonomic literature regarding its flower structure and reproductive biology. To clarify these matters, we observed 20 flowering individuals of S. randaiense in their native habitats in the spring of 2007. The inflorescences of S. randaiense are highly reduced panicles to botryoid cymes, with up to 10 such inflorescences clustered subterminally to form an umbel of panicles and/or cymes. Its flowers are bisexual, and its third-whorl anthers are extrorse, structured as a typical hermaphroditic flower of Lauraceae. Our observations also revealed that its flowers are protogynous and flowers in a reproductive shoot alternate their sexual phase synchronously, suggesting the sexual system of synchronous dichogamy. The temporal dioecy imposed by this sexual system may explain why S. randaiense has been variously described as a dioecious, androdioecious, or polygamous species in the past.";"dtupub";"";"2022-01-06T05:05:33.270Z";"Chung, Kuo-Fang|van der Werff, Henk|Peng, Ching-I";"";"2875070017";"";"dtu";"2010";"";"";"";"";"article";"dtu|dtu_electronic|dtupub|dtupub_electronic";"";"";"";"1";"";"";"1-10";"";"Annals of the Missouri Botanical Garden|Annals of the Missouri Botanical Garden|Ann Mo Bot|Ann Mo Bot Gard|Ann. Mo. Bot. Gard|Missouri Botanical Garden Annals";"Ann Mo Bot|Ann Mo Bot Gard|Ann. Mo. Bot. Gard|Annals of the Missouri Botanical Garden|Missouri Botanical Garden Annals";"00266493|000089|000097|000001|000000";"97";"";"";"";"";"eng";"5d7e40a7d9001d01b8c680e8";"";"5d7e40a7d9001d01b8c680e8";"Missouri Botanical Garden";"jstor";"jstor";"OBSERVATIONS ON THE FLORAL MORPHOLOGY OF SASSAFRAS RANDAIENSE (LAURACEAE)"
"";"dtu|dtupub";"";"2022-01-06T04:51:32.836Z";"EDWARDS, E. W.";"";"2477475383";"";"";"1974";"";"";"";"";"article";"dtu_external|dtupub_external";"";"";"";"196";"";"";"320-321";"";"History|History|History (lond)|History London|History the Journal of the Historical Association";"History|History (lond)|History London|History the Journal of the Historical Association";"00182648|000125|000059|000196|000000";"59";"";"";"";"";"eng";"5d7e45e7d9001d01b8c8115e";"";"5d7e45e7d9001d01b8c8115e";"The Historical Association";"jstor";"jstor";"PACIFIC ESTRANGEMENT: JAPANESE AND AMERICAN EXPANSION 1897–1911"
"";"dtu|dtupub";"";"2022-01-06T04:08:57.901Z";"Guichard-Meili, Jean";"";"2520107965";"";"";"1964";"";"";"";"";"article";"dtu_external|dtupub_external";"";"";"";"329 (7)";"";"";"188-189";"";"Esprit (1940-)|Esprit";"Esprit|Esprit (1940-)";"00140759|000135|000000|000329|000000";"";"";"";"";"";"fre";"5d7e35f5d9001d01b8c345bb";"";"5d7e35f5d9001d01b8c345bb";"Esprit";"jstor";"jstor";"Lettres inédites, (Coll. « Visages de ce temps »)"
"";"dtu|dtupub";"";"2022-01-05T11:45:16.328Z";"CLARK, MICHAEL J.";"";"2477295079";"";"";"1985";"";"";"";"";"article";"dtu_external|dtupub_external";"";"";"";"230";"";"";"468-469";"";"History|History|History (lond)|History London|History the Journal of the Historical Association";"History|History (lond)|History London|History the Journal of the Historical Association";"00182648|000114|000070|000230|000000";"70";"";"";"";"";"eng";"5d7e501ed9001d01b8cb2cdb";"";"5d7e501ed9001d01b8cb2cdb";"GEORGE PHILIP AND SON, LIMITED";"jstor";"jstor";"MENTAL ILLNESS AND AMERICAN SOCIETY, 1875-1940"
"";"dtu|dtupub";"";"2022-01-05T23:50:23.351Z";"BARBICHON, NOEL-FRANÇOIS";"";"2460959862";"";"";"1974";"";"";"";"";"article";"dtu_external|dtupub_external";"";"";"";"439 (10)";"";"";"439-449";"";"Esprit (1940-)|Esprit";"Esprit|Esprit (1940-)";"00140759|000125|000000|000439|000000";"";"";"";"";"";"fre";"5d7e3961d9001d01b8c44b66";"";"5d7e3961d9001d01b8c44b66";"Esprit";"jstor";"jstor";"Le marché de la formation"
"";"dtupub";"";"2022-01-08T19:11:29.816Z";"Toplin, Robert Brent";"";"161249119";"";"";"2004";"";"";"";"";"article";"dtu_external|dtupub_external";"";"";"";"2";"";"";"34-39";"";"Cinã©aste|Cinéaste|Cineaste Americas Leading Magazine on the Art and Politics of the Cinema";"Cineaste Americas Leading Magazine on the Art and Politics of the Cinema|Cinã©aste|Cinéaste";"00097004|000095|000029|000002|000000";"29";"";"";"";"";"eng";"5d7e4e1bd9001d01b8ca9049";"";"5d7e4e1bd9001d01b8ca9049";"Cineaste Publishers, Inc.";"jstor";"jstor";"Cinematic History An Anatomy of the Genre"
"";"dtu|dtupub";"";"2022-01-06T04:12:38.787Z";"ALLEN, CHRISTOPHER";"";"2520109386";"";"dtu";"1997";"";"";"";"";"article";"dtu|dtu_electronic|dtupub_external";"";"";"";"266";"";"";"303-304";"";"History|History|History (lond)|History London|History the Journal of the Historical Association";"History|History (lond)|History London|History the Journal of the Historical Association";"00182648|000102|000082|000266|000000";"82";"";"";"";"";"eng";"5d7e36a0d9001d01b8c37877";"";"5d7e36a0d9001d01b8c37877";"Blackwell Publishers";"jstor";"jstor";"The Early History of the Law of Bills and Notes: A Study of the Origins of Anglo-American Commercial Law"
"";"dtu|dtupub";"";"2022-01-05T23:09:05.044Z";"";"";"2460894479";"";"dtu";"1948";"";"";"";"";"article";"dtu|dtu_electronic|dtupub|dtupub_electronic";"";"";"";"143 (3)";"";"";"472-473";"";"Esprit (1940-)|Esprit";"Esprit|Esprit (1940-)";"00140759|000151|000000|000143|000000";"";"";"";"";"";"fre";"5d7e33d7d9001d01b8c2a3eb";"";"5d7e33d7d9001d01b8c2a3eb";"Esprit";"jstor";"jstor";"POUR SE PRÉVERTIR EN SOCIÉTÉ"
"";"dtupub";"Boston College";"2022-01-09T23:57:48.864Z";"Cronin, James E.";"";"2398093718";"";"dtu";"2014";"";"10.1086/674268";"";"";"article";"dtu|dtu_electronic|dtupub_external";"";"";"";"1";"";"";"179-181";"";"Journal of Modern History|Journal of Modern History|Journal of Modern History|J Mod Hist|J. Mod. Hist|Journal of Modern History";"J Mod Hist|J. Mod. Hist|Journal of Modern History";"00222801|000085|000086|000001|000000";"86";"";"";"";"";"eng";"5d7e5108d9001d01b8cb75e3|5cbef04ad9001d01a4c36954";"";"5cbef04ad9001d01a4c36954";"University of Chicago Press";"jstor|crossref";"jstor|crossref";"Special Relations: The Americanization of Britain? By H. L. Malchow.Stanford, CA: Stanford University Press, 2011. Pp. xx+368. $65.00 (cloth); $65.00 (e-book)"
"";"dtu|dtupub";"";"2022-01-07T08:01:28.471Z";"Montague, F. C.";"";"2427136033";"";"";"1931";"";"10.1111/j.1468-229X.1931.tb00003.x";"";"";"article";"dtu_external|dtupub_external";"";"";"";"61";"";"";"25-34";"";"History|History|History|History (lond)|History London|History the Journal of the Historical Association";"History|History (lond)|History London|History the Journal of the Historical Association";"00182648|000168|000016|000061|000000";"16";"";"";"";"";"eng";"5cb4dc8ad9001d01a459634d|5d7e404bd9001d01b8c66437";"";"5cb4dc8ad9001d01a459634d";"MACMILLAN AND CO., LIMITED";"crossref|jstor";"crossref|jstor";"SOME CAHIERS DE DOLÉANCES, 1789"
"";"dtupub";"";"2022-01-06T05:12:14.484Z";"BECK, PETER J.";"";"160913779";"";"dtu";"2002";"";"";"";"";"article";"dtu|dtu_electronic|dtupub_external";"";"";"";"285";"";"";"189-190";"";"History|History|History (lond)|History London|History the Journal of the Historical Association";"History|History (lond)|History London|History the Journal of the Historical Association";"00182648|000097|000087|000285|000000";"87";"";"";"";"";"eng";"5d7e5107d9001d01b8cb756a";"";"5d7e5107d9001d01b8cb756a";"Blackwell Publishers";"jstor";"jstor";"Sport in Britain, 1945–2000"
"";"dtu|dtupub";"";"2022-01-06T05:10:51.675Z";"WILLAN, T. S.";"";"2520188762";"";"";"1962";"";"";"";"";"article";"dtu_external|dtupub_external";"";"";"";"160";"";"";"197-199";"";"History|History|History (lond)|History London|History the Journal of the Historical Association";"History|History (lond)|History London|History the Journal of the Historical Association";"00182648|000137|000047|000160|000000";"47";"";"";"";"";"eng";"5d7e4b4bd9001d01b8c9b5b5";"";"5d7e4b4bd9001d01b8c9b5b5";"Routledge and Kegan Paul";"jstor";"jstor";"MERCHANTS AND MARINERS OF THE EIGHTEENTH CENTURY"
"";"dtu|dtupub";"";"2022-01-06T00:13:26.656Z";"Yüan-ling, Chao";"";"2461168583";"";"dtu";"2000";"";"";"";"";"article";"dtu|dtu_electronic|dtupub|dtupub_electronic";"";"";"";"17";"";"";"66-93";"";"East Asian Science, Technology, and Medicine|East Asian Science, Technology, and Medicine|East Asian Science, Technology, and Medicine";"East Asian Science, Technology, and Medicine";"1562918x|000099|000000|000017|000000";"";"";"";"";"";"eng";"5d7e4ae3d9001d01b8c99635";"";"5d7e4ae3d9001d01b8c99635";"International Society for the History of East Asian Science, Technology, and Medicine (ISHEASTM)";"jstor";"jstor";"The Ideal Physician in Late Imperial China: The Question of Sanshi 小戴"
"";"dtu|dtupub";"";"2022-01-06T04:17:30.607Z";"Schmidt, Moriz";"";"2460969811";"";"dtu";"1868";"";"";"";"";"article";"dtu|dtu_electronic|dtupub|dtupub_electronic";"";"";"";"4";"";"";"477-479";"";"Beitrã¤ge Zur Vergleichenden Sprachforschung Auf Dem Gebiete Der Arischen, Celtischen Und Slawischen Sprachen|Beiträge Zur Vergleichenden Sprachforschung Auf Dem Gebiete Der Arischen, Celtischen Und Slawischen Sprachen";"Beitrã¤ge Zur Vergleichenden Sprachforschung Auf Dem Gebiete Der Arischen, Celtischen Und Slawischen Sprachen|Beiträge Zur Vergleichenden Sprachforschung Auf Dem Gebiete Der Arischen, Celtischen Und Slawischen Sprachen";"09372687|000231|000005|000004|000000";"5";"";"";"";"";"ger";"5d7e3a35d9001d01b8c48baf";"";"5d7e3a35d9001d01b8c48baf";"Ferd. Dümmlers Verlagsbuchhandlung";"jstor";"jstor";"Inschrift von Xanthus N. 6"
"";"dtu|dtupub";"";"2022-01-06T04:11:06.476Z";"";"";"2461092005";"";"";"1973";"";"";"";"";"article";"dtu_external|dtupub_external";"";"";"";"3";"";"";"311-312";"";"American Bar Association Journal|American Bar Association Journal|Am Bar Assoc J";"Am Bar Assoc J|American Bar Association Journal";"00027596|000126|000059|000003|000000";"59";"";"";"";"";"eng";"5d7e3647d9001d01b8c35ddd|5d7e4485d9001d01b8c7a5f4";"";"5d7e3647d9001d01b8c35ddd";"American Bar Association";"jstor";"jstor";"Professional Ethics Opinions"
"";"dtu|dtupub";"";"2022-01-06T04:45:24.722Z";"Crandall, Maureen S.";"";"2477469871";"";"dtu";"2010";"";"";"";"";"article";"dtu|dtu_electronic|dtupub_external";"";"";"";"2";"";"";"199-204";"";"Energy Journal|Energy Journal|Energ J|Energy J|Energy Journal";"Energ J|Energy J|Energy Journal";"01956574|000089|000031|000002|000000";"31";"";"";"";"";"eng";"5d7e44dcd9001d01b8c7c014";"";"5d7e44dcd9001d01b8c7c014";"Energy Economics Education Foundation, Inc.";"jstor";"jstor";"A Smart Energy Policy: An Economist's Rx for Balancing Cheap, Clean, and Secure Energy"
"S'il est indiscutable qu'il y a eu un esprit antitotalitaire qui puisait à plusieurs sources (Socialisme ou Barbarie, Soljenitsyne, Lefort, Castoriadis...), cette mouvance est aujourd'hui écartelée sur les questions de la souveraineté, de l'Europe ou du droit. Demeure plus que jamais l'impératif de penser l'histoire en termes politiques, qui donnent tout son sens à la culture politique antitotalitaire.";"dtu|dtupub";"";"2022-01-05T11:42:54.412Z";"Mongin, Olivier";"";"2461226647";"";"";"2000";"";"";"";"";"article";"dtu_external|dtupub_external";"";"";"";"263 (5)";"";"";"76-90";"";"Esprit (1940-)|Esprit";"Esprit|Esprit (1940-)";"00140759|000099|000000|000263|000000";"";"";"";"";"";"fre";"5d7e4fb4d9001d01b8cb0c6c";"";"5d7e4fb4d9001d01b8cb0c6c";"Esprit";"jstor";"jstor";"Le courant antitotalitaire et les impasses de la réflexion politique"
"";"dtupub";"University of Illinois at Urbana‐Champaign";"2022-01-13T03:40:03.085Z";"Burton, Antoinette";"";"2398051044";"";"dtu";"2002";"";"10.1086/376227";"";"";"article";"dtu|dtu_electronic|dtupub_external";"";"";"";"4";"";"";"849-850";"";"Journal of Modern History|Journal of Modern History|Journal of Modern History|J Mod Hist|J. Mod. Hist|Journal of Modern History";"J Mod Hist|J. Mod. Hist|Journal of Modern History";"00222801|000097|000074|000004|000000";"74";"";"";"";"";"eng";"56d869d45b3804ae4211b3f4|5cbe8eacd9001d01a4aa628c";"";"5cbe8eacd9001d01a4aa628c";"The University of Chicago Press";"jstor|crossref";"jstor|crossref";"An Empire on Display: English, Indian, and Australian Exhibitions from the Crystal Palace to the Great War. By Peter H. Hoffenberg. Berkeley and Los Angeles: University of California Press, 2001. Pp. xxvii+418. $50.00"
"The ongoing struggle over welfare reform hinges on debate over which factors cause joblessness and poverty. Conservative scholars blame lack of work experience and a culture of poverty while liberals focus on lack of skills and structural inequality. Through a synthesis of six interrelated research studies conducted between 1992 and 1996, this paper examines the relationship between macro-and micro-level factors in the career and training paths of welfare recipients. The study illustrates the utility of a holistic, anthropological approach to the study of poverty. The studies found four distinct groups: 1) limited work experience; 2) low-skill workers; 3) displaced workers; and 4) immigrants and refugees. Social networks played a powerful role in the life histories of each group. Using a combination of statistics and ethnography, the article discusses different career and training paths for each group. The relationship between training and work experience for each group shows the nuances among training programs and the way that class, race, and gender work together to influence various ways that each group makes use of training in developing unique pathways to opportunity or continued poverty.";"dtupub";"";"2022-01-07T10:21:42.679Z";"Schneider, Jo";"";"2854297290";"";"";"2000";"";"10.17730/humo.59.1.j3m1r84h1jx0407l";"";"";"article";"dtu_external|dtupub_external";"";"";"";"1";"";"";"72-85";"";"Human Organization|Human Organization|Human Organization|Hum Organ|Hum. Organ";"Hum Organ|Hum. Organ|Human Organization";"00187259|000099|000059|000001|000000";"59";"";"";"";"";"eng";"5cb8c367d9001d01a4f13698|5d7e45edd9001d01b8c81381";"";"5cb8c367d9001d01a4f13698";"Society for Applied Anthropology";"crossref|jstor";"crossref|jstor";"Pathways to Opportunity: The Role of Race, Social Networks, Institutions, and Neighborhood in Career and Educational Paths for People on Welfare"
