faculty,top_terms
"DTU Department of Technology, Management and Economics",waste|time|energy|connectedness|csp|og|model|10|figure|af|scenario|brent|er|enterprises|eua|data|det|middelalderbyen|case|pv
DTU Department of Chemical and Biochemical Engineering,co2|koh|model|impeller|liquid|figure|gas|pz|10|fermentation|time|process|mass|transfer|flow|concentration|mea|compartment|solvent|oxygen
DTU National Institute of Aquatic Resources,eelgrass|gear|eel|fyke|fish|aqua|habitat|species|trip|field|caught|oxygen|stations|beds|50|dtu|page|study|night|control
DTU Department of Civil and Mechanical Engineering,waste|curriculum|design|guide|teachers|teacher|mcfc|makerspaces|cabin|greenland|behavioural|figure|curricula|co2|management|fuel|used|vehicle|dome|hwm
DTU Department of Environmental and Resource Engineering,backwash|sludge|det|cid|er|så|ja|og|arsenic|sofie|kjeldsen|water|jeg|grube|ikke|dpc|der|10|kan|på
DTU Department of Health Technology,tis|speech|sequences|model|cochlear|sequence|music|implant|models|learning|intelligibility|used|embeddings|figure|data|network|generative|netstart|codon|dataset
DTU Department of Applied Mathematics and Computer Science,model|data|figure|10|cid|eeg|using|diabetes|genai|time|transformer|used|vp|sleep|models|deg|network|based|user|results
DTU Department of Energy Conversion and Storage,srtio3|cathode|electrolyte|figure|battery|coin|membrane|batteries|swagelok|coated|lasrmno3|sulfur|magnetic|discharge|membranes|cell|vol|na|film|substrate
DTU Department of Wind and Energy Systems,wind|wake|turbine|jacket|actuator|figure|offshore|abl|laminate|floating|turbines|optimization|energy|fowts|element|topology|design|10|inflow|velocity
DTU DTU National Food Institute,fermentation|whey|goat|campylobacter|vodka|gw|isolates|10|ethanol|hydrolysis|cgmlst|mers|trypsin|protein|loci|pasteurized|pepsin|mlst|model|source
DTU Department of Biotechnology and Biomedicine,gluc|pseudomonas|co₂|pcr|et|al|mtppo|enzyme|mutants|arginine|rpod|16s|10|luminescence|dac|ctz|activity|amplicon|protein|r76a
DTU Department of Civil Engineering,cid|model|rca|pls|figure|stiffness|shear|clay|10|rdm|cauc|paleogene|triaxial|concrete|clt|soil|stress|resistance|screws|et
DTU Department of Electrical and Photonics Engineering,cid|avs|figure|radar|data|swap|solar|28|pitch|decoding|sb2s3|fusion|decoder|err|microclimate|panels|params|wind|fault|faults
DTU Department of Electrical Engineering,door|offices|acoustic|needle|corridor|cid|nh|figure|speech|noise|insertion|image|office|gripper|open|satisfaction|detection|plan|hough|lp
DTU Department of Space Research and Space Technology,pinn|field|training|earths|satellite|neural|data|network|informed|points|loss|core|bfgs|l2|stations|figure|true|collocation|time|error
DTU Department of Physics,energy|detector|detectors|ammonia|electrochemical|ray|cdte|electrolyte|figure|10|copper|silver|pixel|lithium|argo|band|used|photon|resolution|upd
DTU Department of Chemistry,linker|joakim|1h|svensson|compound|mikkel|cleavable|dmso2|2h|drug|reaction|ppm|29|nmr|scheme|ml|dd|10|august|mmol
