"abstract_ts";"access_ss";"Affiliations";"Timestamp";"Author";"citation_count_i";"ID";"dtu_library_collection_facet";"collection_facet";"Publication Year";"Conference";"DOI";"Editor";"embargo_ssf";"format";"fulltext_availability_facet";"has_openaccess_fulltext_b";"holdings_ssf";"ISBN";"Journal Issue";"journal_issue_tsort";"journal_oa_model_ss";"Journal Page";"journal_page_start_tsort";"Journal Title";"journal_title_facet";"toc_key_s";"Journal Volume";"journal_vol_tsort";"keywords_ts";"keywords_facet";"keywords_normalized";"isolanguage_facet";"member_id_ss";"ORCID";"primary_member_id_s";"Publisher";"Source";"source_all_ss";"Title"
"Intelligente computer-baserede systemer, som behandler tekstdokumenter er et aktivt forskningsområde. Søgemaskiner er højst sandsynligt det bedst kendte eksempel på, at  anvendelsen af statistisk analyse af ustruktureret tekst kan være særdeles effektiv. Men der findes et væld af andre mulige anvendelser, hvor statistisk tekst modellering vil være velegnet. Et andet eksempel er matching af jobansøgere og job. Arbejdsgivere  bruger mange resourcer på at finde den rette ansøger, og  jobansøgere bruger tilsvarende mange resourcer i søgningen efter det rette job. Intelligente systemer, som automatisk og pålideligt  kunne matche ansøgere og job ville spare mange kræfter. Dette eksamensprojekt er blevet inspireret af jobmatching-problemet og  lignende matching-problemer. Målet er at finde frem til velegnede statistiske modeller for matching-problemer og at udføre en grundig analyse af disse modeller - både teoretisk og eksperimentielt. Søgemaskiner hører til indenfor Information Retrieval. Vores studier af dette område viser, at der har været en del fokus på modeller, som beskæftiger sig med linkstrukturer. Med  linkstrukturer menes dokumenter, som er indbyrdes forbundet med links. I forbindelse med matching-problemer kan det vise sig meget  interessant, fordi et link minder meget om et match. Probalistic Latent Semantic Indexing (PLSI) er en model som kan udvides til,  udover ord, også at repræsentere links. I dette eksamensprojekt  bliver det vist, at PLSI er i stand til at ""forstå"" semantik i tekstdokumenter. Udvides PLSI dernæst med links, er modellen også  til en vis grad i stand til at forudsige hvilke links et dokument  burde have udfra dets tekstindhold. Dette virker bedst, hvis linkstrukturen er rimelig tæt. Intentionen er, at den insigt i statistisk tekstmodellering, som formidles i denne rapport vil vise sig nyttig under design af intelligente computersystemer for matching-problemer. in English: Automatic systems dealing with text is an  active area of research. Search engines are probably the most successful and well-known area where statistical analysis of  unstructured text documents have proven very useful. But there are  a vast amount of potential applications, which are suitable for  statistical text modelling. One such application is the matching  of job applicants with job offers. Large amounts of human  resources are used today on the search for future employees and - from the applicant's perspective - on the search for the right job. Successful automatic systems would be very welcome in this area. This master thesis has been motivated by the job matching  problem and related matching problems. The objective is to find suitable models for matching problems and to perform a thorough  analysis of these models from a theoretical and from an  experimental perspective. Search engines belong to the area of Information Retrieval. In Information Retrieval there has been a lot of focus on models dealing with link structures - that is, documents interconnected by links - and links are interesting, because a link is very  similar to a match. The Probalistic Latent Semantic Indexing (PLSI) model is a model, which can be extended to incorporate link information. This thesis shows that PLSI is a model capable of  capturing semantics in text documents. Furthermore when extended with link information it is capable of predicting links to some degree in environments where link information is not too sparse. It is the hope that the insight and the capabilities of the models  presented here will turn out useful when building automatic systems for matching problems or related problems.";"dtu|dtupub|third_party";"[affiliation name could not be established]|Department of Informatics and Mathematical Modeling, Technical University of Denmark|[affiliation unknown]";"2022-01-03T18:56:47.653Z";"Birch, Sune";"";"2392815711";"";"dtu";"2003";"";"";"";"";"thesis";"dtu|dtu_electronic|dtupub|dtupub_electronic";"";"";"";"";"";"";"";"";"";"";"";"";"";"Statistical text modelling|Probalistic Latent Semantic Indexing|PLSI|PLINK|Supervised PLSI|Job matching";"Job matching|PLINK|PLSI|Probalistic Latent Semantic Indexing|Statistical text modelling|Supervised PLSI";"Statistical text modelling|Probalistic Latent Semantic Indexing|PLSI|PLINK|Supervised PLSI|Job matching";"und";"5a02e3295010df4c820fe2e5";"";"5a02e3295010df4c820fe2e5";"Department of Informatics and Mathematical Modeling, Technical University of Denmark, DTU";"etd";"etd";"Statistical text modelling - Towards modelling of matching problems"
"";"dtu|dtupub|third_party";"[affiliation name could not be established]|Intelligent Signal Processing, Department of Informatics and Mathematical Modeling, Technical University of Denmark|[affiliation unknown]";"2022-01-03T18:56:38.020Z";"Brazinskas, Ricardas";"";"2392815090";"";"dtu";"2008";"";"";"";"";"thesis";"dtu|dtu_electronic|dtupub|dtupub_electronic";"";"";"";"";"";"";"";"";"";"";"";"";"";"";"";"";"und";"5a02e31d5010df4c820fe073";"";"5a02e31d5010df4c820fe073";"";"etd";"etd";"Towards Context Awareness Using Mobile Sensors"
"Undersøgelse af hvordan anvendelse af e-business kan fremme reservedealsalget hos FLS.";"dtu|dtupub|third_party";"[affiliation name could not be established]|[affiliation unknown]";"2022-01-03T18:57:30.150Z";"Immerkjær, Kasper";"";"2392818489";"";"";"2002";"";"";"";"";"thesis";"dtu_external|dtupub_external";"";"";"";"";"";"";"";"";"";"";"";"";"";"Industrial management";"Industrial management";"Industrial management";"und";"5a02e35e5010df4c820fedcc";"";"5a02e35e5010df4c820fedcc";"IPL";"etd";"etd";"Redesign af F.L.Smidths eftersalg"
"";"dtu|dtupub|third_party";"[affiliation name could not be established]|Afdeling for Fødevarekemi, Fødevareinstituttet, Danmarks Tekniske Universitet|[affiliation unknown]";"2022-01-03T18:56:56.392Z";"Sørensen, Michael Knoth";"";"2392816284";"";"";"1997";"";"";"";"";"thesis";"dtu_external|dtupub_external";"";"";"";"";"";"";"";"";"";"";"";"";"";"";"";"";"und";"5a02e3345010df4c820fe527";"";"5a02e3345010df4c820fe527";"Fødevareinstituttet, Danmarks Tekniske Universitet, DTU";"etd";"etd";"Bestemmelse af toxaphen i sild"
"";"dtu|dtupub|third_party";"Division of Toxicology and Risk Assessment, National Food Institute, Technical University of Denmark";"2022-01-03T18:57:20.672Z";"";"";"2392817872";"";"";"2009";"";"";"";"";"thesis";"dtu_external|dtupub_external";"";"";"";"";"";"";"";"";"";"";"";"";"";"";"";"";"und";"5a02e3525010df4c820feb60";"";"5a02e3525010df4c820feb60";"";"etd";"etd";"Phytoøstrogeners effekt på PPAR alfa og gamma"
"";"dtu|dtupub|third_party";"Department of Systems Biology, Technical University of Denmark|Center for Microbial Biotechnology, Department of Systems Biology, Technical University of Denmark";"2022-01-03T18:56:31.596Z";"Petersen, Ea";"";"2392814894";"";"";"2008";"";"";"";"";"thesis";"dtu_external|dtupub_external";"";"";"";"";"";"";"";"";"";"";"";"";"";"";"";"";"und";"5a02e3195010df4c820fdfaa";"";"5a02e3195010df4c820fdfaa";"";"etd";"etd";"LC-MS analysis of microbial metabolites"
"";"dtu|dtupub|third_party";"Research Center COM, Technical University of Denmark";"2022-01-03T18:57:09.213Z";"Rovik, D.B.";"";"2392817098";"";"";"2002";"";"";"";"";"thesis";"dtu_external|dtupub_external";"";"";"";"";"";"";"";"";"";"";"";"";"";"";"";"";"und";"5a02e3435010df4c820fe856";"";"5a02e3435010df4c820fe856";"";"etd";"etd";"Performance studie og forbedring af specifik e-business løsning"
"";"dtu|dtupub|third_party";"[affiliation name could not be established]|Automation, Ørsted DTU, Danmarks Tekniske Universitet|[affiliation unknown]";"2022-01-03T18:56:44.647Z";"Arnason, Valur";"";"2392815521";"";"";"2006";"";"";"";"";"thesis";"dtu_external|dtupub_external";"";"";"";"";"";"";"";"";"";"";"";"";"";"";"";"";"und";"5a02e3255010df4c820fe225";"";"5a02e3255010df4c820fe225";"";"etd";"etd";"Modellering af Kynbyværkets reguleringsstrategi"
"It is widely known the importance of the optimization of the cost of the public transport. This includes the time saving of the users as well as the real cost of the infrastructures. Literature shows that genetic algorithms are useful tool to reach the optimum in similar situations [ref. 01]. GA’s method creates a set of solutions, and in the same way as the real genetics, evolves solutions trough several generations until the optimum. This process makes the solution space explored much more extensive, thus becoming a good method for this problem. Applying GA’s to an existing single bus line, results showed that the behaviour of the GA converges to a minimum cost and the optimum timetable is similar to the existing one. These satisfactory results motivated the application of GA to a bus network. Although the optimal timetable obtained in this simulation does not bring relevant information since it is not based on a real network, the trend of the GA evolution is to converge in a minimum cost, in the same way as the optimization of a single bus line. In conclusion GA’s can be considered as a useful tool to optimize bus network scheduling problems. Nevertheless, further work in this subject using real networks and reliable data is encouraged so that more conclusive and realist results can be obtained.";"dtu|dtupub|third_party";"[affiliation name could not be established]|Traffic Modelling Group, Centre for Traffic and Transport, Technical University of Denmark|[affiliation unknown]";"2022-01-03T18:56:44.499Z";"Guillaumet, Joan Ballano";"";"2392815453";"";"dtu";"2007";"";"";"";"";"thesis";"dtu|dtu_electronic|dtupub|dtupub_electronic";"";"";"";"";"";"";"94 s.";"";"";"";"";"";"";"";"";"";"und";"5a02e3245010df4c820fe1df";"";"5a02e3245010df4c820fe1df";"";"etd";"etd";"""Improving bus timetables"""
"";"dtu|dtupub|third_party";"[affiliation name could not be established]|Teknologi, Organisation og Arbejde, Institut for Planlægning, Innovation og Ledelse, Danmarks Tekniske Universitet|Operations Management, Institut for Planlægning, Innovation og Ledelse, Danmarks Tekniske Universitet|[affiliation unknown]";"2022-01-03T18:57:20.622Z";"Hansen, Jan E. D|Jacobsen, Søren W.";"";"2392817851";"";"";"2008";"";"";"";"";"thesis";"dtu_external|dtupub_external";"";"";"";"";"";"";"";"";"";"";"";"";"";"";"";"";"und";"5a02e3525010df4c820feb4b";"";"5a02e3525010df4c820feb4b";"";"etd";"etd";"Design af lean lager- og pakkesystem: fortrolig"
"";"dtu|dtupub|third_party";"[affiliation name could not be established]|Operations Management, Institut for Planlægning, Innovation og Ledelse, Danmarks Tekniske Universitet|[affiliation unknown]";"2022-01-03T18:56:42.407Z";"Hollesen Eirikstoft, Steinar";"";"2392815346";"";"";"2009";"";"";"";"";"thesis";"dtu_external|dtupub_external";"";"";"";"";"";"";"";"";"";"";"";"";"";"";"";"";"und";"5a02e3225010df4c820fe174";"";"5a02e3225010df4c820fe174";"Danmarks Tekniske Universitet  (DTU)";"etd";"etd";"Lean og Six Sigma hos NNE Pharmaplan: fortrolig"
"";"dtu|dtupub|third_party";"[affiliation name could not be established]|[affiliation unknown]";"2022-01-03T18:56:45.442Z";"Damgaard Christensen, Jens|Arnskov Nielsen, Martin";"";"2392815553";"";"";"2009";"";"";"";"";"thesis";"dtu_external|dtupub_external";"";"";"";"";"";"";"";"";"";"";"";"";"";"";"";"";"und";"5a02e3265010df4c820fe245";"";"5a02e3265010df4c820fe245";"";"etd";"etd";"Simulering hos Siemens Wind Power"
"This thesis describes a method for automated characterisation and recognition of Corpus Callosum brain structure from 3-dimensional magnetic resonance images and relation of derived shape parameters to clinical and cognitive performance data. Thesis is a product of project research carried due to a collaboration between Informatics and Mathematical Modelling, DTU and the MR Department at Hvidovre University Hospital. Medical data was gathered during Leukoaraiosis And DiSability in the elderly (LADIS) study. Thesis is focused on accurate characterization of dependence of change in shape of Corpus Callosum during the period of three years for each subject, as well as corelating these changes with changes in cognitive performance data. Prior to characterisation of Corpus Callosum shape, the magnetic resonance data is used to define the most proper Mid Saggital surface in both baseline and follow up data sets, to reveal the corresponding parts of Corpus Callosum. The surface determination is based on local symmetry measures along respective parts of MRI data and Median as well as Average filtering of the results. Shape definition is based on contour defined by means of dynamic programming on image gradient values. Shape changes and variations among the subjects are examined by means of Principal Component Analysis.";"dtu|dtupub|third_party";"[affiliation name could not be established]|Image Analysis and Computer Graphics, Department of Informatics and Mathematical Modeling, Technical University of Denmark|[affiliation unknown]";"2022-01-03T18:56:53.844Z";"Blaszczyk, Maciej Jerzy";"";"2392816081";"";"dtu";"2008";"";"";"";"";"thesis";"dtu|dtu_electronic|dtupub|dtupub_electronic";"";"";"";"";"";"";"";"";"";"";"";"";"";"";"";"";"und";"5a02e3305010df4c820fe459";"";"5a02e3305010df4c820fe459";"";"etd";"etd";"Automated Characterization and Recognition of 2D and 3D Brain Structure in MRI for Diagnostic Support"
"";"dtu|dtupub|third_party";"[affiliation name could not be established]|CHEC Research Centre, Department of Chemical and Biochemical Engineering, Technical University of Denmark|Center for Phase Equilibria and Separation Processes, Institut for Kemiteknik, Danmarks Tekniske Universitet|Hempel|[affiliation unknown]";"2022-01-03T18:56:40.214Z";"Blasco, Ana Pardos";"";"2392815263";"";"";"2008";"";"";"";"";"thesis";"dtu_external|dtupub_external";"";"";"";"";"";"";"";"";"";"";"";"";"";"";"";"";"und";"5a02e3205010df4c820fe120";"";"5a02e3205010df4c820fe120";"";"etd";"etd";"Epoxy coatings: behavior with temperature and their use in Nuclear Power Plants"
"Smart house installations are becoming more and more popular all over the world. They help to improve the quality of a daily life, reduce costs and increase security.   The main goal of this project is to develop a JAVA tool for designing and simulating simple 2D model of a smart house. The tool provides the ability to design the physical boundaries of a house, position a set of sensors inside it, and observe the operation of a house through a set of scenarios, where human behaviour will trigger the sensors. Both sensors infrastructure and building of scenarios are designed in a way that enables their easy extension in the future. Program is logging its operation, giving ability to experiment with scenarios and check their validity.  As conclusions extension possibilities are outlined, with the most important of them being development of logic unit (programmable or adaptive), governing the house operation, making the software a real smart house simulator.";"dtu|dtupub|third_party";"[affiliation name could not be established]|Computer Science and Engineering, Informatics and Mathematical Modelling, Technical University of Denmark|[affiliation unknown]";"2022-01-03T18:57:09.299Z";"Krzyska, Cyryl";"";"2392817139";"";"dtu";"2006";"";"";"";"";"thesis";"dtu|dtu_electronic|dtupub|dtupub_electronic";"";"";"";"";"";"";"";"";"";"";"";"";"";"";"";"";"und";"5a02e3445010df4c820fe880";"";"5a02e3445010df4c820fe880";"";"etd";"etd";"Smart House Simulation Tool"
"";"dtu|dtupub|third_party";"";"2022-01-03T13:05:53.366Z";"Agnarsdóttir, Hrafnhildur";"";"2596066772";"";"dtu";"2020";"";"";"";"";"thesis";"dtu|dtu_electronic|dtupub|dtupub_electronic";"";"";"";"";"";"";"";"";"";"";"";"";"";"";"";"";"und";"5f312bc1d9001d016b4e244d";"";"5f312bc1d9001d016b4e244d";"DTU Department of Health Technology";"sorbit";"sorbit";"A Bayesian Approach to a Genome Wide Association Study of Childhood Respiratory Infections|En Bayesiansk tilgang til et Genome Wide Association studie af respiratoriske infektioner hos børn"
"";"dtu|dtupub|third_party";"";"2022-01-03T13:05:54.724Z";"Borre, Anja Lykke";"";"2604853398";"";"dtu";"2020";"";"";"";"";"thesis";"dtu|dtu_electronic|dtupub|dtupub_electronic";"";"";"";"";"";"";"";"";"";"";"";"";"";"";"";"";"und";"5f99603ad9001d016970fe47";"";"5f99603ad9001d016970fe47";"DTU Department of Health Technology";"sorbit";"sorbit";"Lensless  Light  Sheet  Generation  and  Dynamic Control using Multicore Fibers|Linsefri skabelse og dynamisk kontrollering af lysark ved brug af multikerne fibre"
"";"dtu|dtupub|third_party";"";"2022-01-03T13:05:39.840Z";"Cardi, Lorenzo";"";"2438417663";"";"dtu";"2018";"";"";"";"";"thesis";"dtu|dtu_electronic|dtupub|dtupub_electronic";"";"";"";"";"";"";"";"";"";"";"";"";"";"";"";"";"und";"5b740a5c5010df01815981d9";"";"5b740a5c5010df01815981d9";"DTU Department of Electrical and Photonics Engineering";"sorbit";"sorbit";"Implementation of chip-to-chip quantum communication protocol based on HOM interference|Implementering af chip-to-chip quantum kommunikationsprotokol baseret pa HOM interferens."
"";"dtu|dtupub|third_party";"";"2022-01-03T13:05:36.084Z";"Boye, August";"";"2436371772";"";"dtu";"2018";"";"";"";"";"thesis";"dtu|dtu_electronic|dtupub_external";"";"";"";"";"";"";"";"";"";"";"";"";"";"";"";"";"und";"5b3a08595010df021d5b4e75";"";"5b3a08595010df021d5b4e75";"DTU Department of Chemical and Biochemical Engineering";"sorbit";"sorbit";"In-line dispersion techniques for efficient coating production|In-line dispergeringsteknikker for effektiv coating produktion"
"";"dtu|dtupub|third_party";"";"2022-01-03T13:05:34.704Z";"Puerto, Juan Carlos Torres";"";"2397914637";"";"dtu";"2018";"";"";"";"";"thesis";"dtu|dtu_electronic|dtupub|dtupub_electronic";"";"";"";"";"";"";"";"";"";"";"";"";"";"";"";"";"und";"5abfd0a95010df3ce579c741";"";"5abfd0a95010df3ce579c741";"DTU National Institute of Aquatic Resources";"sorbit";"sorbit";"Effects of salmon crowding during operational practices in sea cages on the dispersion of salmon lice|Effekter af laksesammentrængning pa spredning af lakselus under driftsforhold i havbure"
"";"dtu|dtupub|third_party";"";"2025-09-11T00:10:10.029Z";"Kristiansen, Thor Eg Gambarini";"";"2873765687";"";"dtu";"2025";"";"";"";"";"thesis";"dtu|dtu_electronic|dtupub_external";"";"";"";"";"";"";"";"";"";"";"";"";"";"";"";"";"und";"68c21361dfafcb10744de9c1";"";"68c21361dfafcb10744de9c1";"DTU Department of Civil and Mechanical Engineering";"sorbit";"sorbit";"Finite element modeling of a geometrically nonlinear cable system in a suspension bridge|Elementmetodemodellering af geometriske ikke-lineære kabelsystemer i en hængebro"
"";"dtu|dtupub|third_party";"";"2025-09-08T00:09:40.591Z";"Råen, Gunnhild";"";"2873651603";"";"dtu";"2025";"";"";"";"";"thesis";"dtu|dtu_electronic|dtupub|dtupub_electronic";"";"";"";"";"";"";"";"";"";"";"";"";"";"";"";"";"und";"68be1ec4bb3d83f84642a80b";"";"68be1ec4bb3d83f84642a80b";"DTU Department of Environmental and Resource Engineering";"sorbit";"sorbit";"A Comparative Study of Geographical Differences in Light Exposure and Sleep Quality in Northern and Southern Norway/ Denmark|En undersøgelse af geografiske forskelle i lyseksponering og søvnkvalitet i Nord- og Sydnorge/Danmark"
"";"dtu|dtupub|third_party";"[affiliation name could not be established]|Computer Aided Process Engineering Center, Department of Chemical Engineering, Technical University of Denmark|[affiliation unknown]";"2022-01-03T18:57:01.028Z";"Loso Nieto, Luis Miguel|Jørgensen, Sten Bay";"";"2392816464";"";"";"2002";"";"";"";"";"thesis";"dtu_external|dtupub_external";"";"";"";"";"";"";"";"";"";"";"";"";"";"";"";"";"und";"5a02e3375010df4c820fe5db";"";"5a02e3375010df4c820fe5db";"";"etd";"etd";"Modelling of Elsinore Waste water plant"
"";"dtu|dtupub|third_party";"";"2022-01-03T13:07:53.535Z";"Jensen, Jakob Sloth|Ingason, Guðmundur Lár";"";"2292738432";"";"dtu";"2014";"";"";"";"";"thesis";"dtu|dtu_electronic|dtupub|dtupub_electronic";"";"";"";"";"";"";"";"";"";"";"";"";"";"Bygningsdesign|Master of Science in Engineering|Master og Science in Architectural Engineering|kandidat";"Bygningsdesign|Master of Science in Engineering|Master og Science in Architectural Engineering|kandidat";"Bygningsdesign|Master of Science in Engineering|Master og Science in Architectural Engineering|kandidat";"und";"56d754bebf19455102000cd6";"";"56d754bebf19455102000cd6";"DTU Department of Civil Engineering";"sorbit";"sorbit";"Case study of Viborg Town Hall: Performance of Sustainable Technologies|Case study of Viborg Town Hall: Performance of sustainable technologies"
"";"dtu|dtupub|third_party";"";"2022-03-16T12:10:08.811Z";"Paludan, Jonas Bøggild";"";"2708496656";"";"dtu";"2022";"";"";"";"";"thesis";"dtu|dtu_electronic|dtupub|dtupub_electronic";"";"";"";"";"";"";"";"";"";"";"";"";"";"";"";"";"und";"6231d3a04792a4b3b5437446";"";"6231d3a04792a4b3b5437446";"DTU Department of Space Research and Space Technology";"sorbit";"sorbit";"Spatial correlation in water level variations of Arctic rivers and lakes|Rumlige korrelation af vandniveau ændringer i arktiske floder og søer baseret pa satellit altimetry"
"";"dtu|dtupub|third_party";"";"2022-07-24T00:10:18.039Z";"Heiede, Alexander Gale";"";"2712806187";"";"dtu";"2022";"";"";"";"";"thesis";"dtu|dtu_electronic|dtupub|dtupub_electronic";"";"";"";"";"";"";"";"";"";"";"";"";"";"";"";"";"und";"62dc8de9d4f41d54e4998312";"";"62dc8de9d4f41d54e4998312";"DTU Department of Civil Engineering";"sorbit";"sorbit";"Study on the use of the ISO 19650 series on Danish projects, and its impact on a Danish market|Undersøgelse om ISO 19650 seriens brug pa danske projekter, og dets indflydelse pa et dansk marked"
"";"dtu|dtupub|third_party";"";"2022-07-25T00:10:25.832Z";"Cardoso, José Dinis Batista";"";"2712810180";"";"dtu";"2022";"";"";"";"";"thesis";"dtu|dtu_electronic|dtupub|dtupub_electronic";"";"";"";"";"";"";"";"";"";"";"";"";"";"";"";"";"und";"62dddf71e314eb54e4e34ce0";"";"62dddf71e314eb54e4e34ce0";"DTU Department of Technology, Management and Economics";"sorbit";"sorbit";"Data Analysis in Football Scouting: A Competitive Analysis of Scouting Applications and Market Opportunities|Data Analysis in Football Scouting: A Competitive Analysis of Scouting Applications and Market Opportunities"
"";"dtu|dtupub|third_party";"";"2022-07-24T00:10:13.188Z";"Bogdanova, Sofia";"";"2712806095";"";"dtu";"2022";"";"";"";"";"thesis";"dtu|dtu_electronic|dtupub|dtupub_electronic";"";"";"";"";"";"";"";"";"";"";"";"";"";"";"";"";"und";"62dc8de56727f054e44b35f2";"";"62dc8de56727f054e44b35f2";"DTU Department of Applied Mathematics and Computer Science";"sorbit";"sorbit";"Test Automation Pyramid in Practice|Test Automatiserings Pyramide i Praksis"
"";"dtu|dtupub|third_party";"";"2022-02-09T12:31:51.075Z";"Kirkegaard, Frederik";"";"2707111909";"";"dtu";"2022";"";"";"";"";"thesis";"dtu|dtu_electronic|dtupub_external";"";"";"";"";"";"";"";"";"";"";"";"";"";"";"";"";"und";"6203af34de77d41bb6fb55e0";"";"6203af34de77d41bb6fb55e0";"DTU Department of Applied Mathematics and Computer Science";"sorbit";"sorbit";"Random Access in LZ77-Compressed Text|Opslag i LZ77-komprimeret tekst"
"";"dtu|dtupub|third_party";"";"2022-07-31T00:09:48.126Z";"Lørup, Siff Nejst";"";"2712907468";"";"dtu";"2022";"";"";"";"";"thesis";"dtu|dtu_electronic|dtupub|dtupub_electronic";"";"";"";"";"";"";"";"";"";"";"";"";"";"";"";"";"und";"62e5c84c708f3aa4465612f4";"";"62e5c84c708f3aa4465612f4";"DTU Department of Civil Engineering";"sorbit";"sorbit";"Potential of sulfide containing mine tailings in cementitious binders|Potentiale af sulfidholdige mineaffald i cement bundne byggematerialer"
"";"dtu|dtupub|third_party";"";"2022-01-03T13:07:02.415Z";"Nielsen, Rasmus von Wurstemberger";"";"2306781417";"";"dtu";"2016";"";"";"";"";"thesis";"dtu|dtu_electronic|dtupub|dtupub_electronic";"";"";"";"";"";"";"";"";"";"";"";"";"";"Bygningsdesign|Master of Science in Engineering|Master og Science in Architectural Engineering|kandidat";"Bygningsdesign|Master of Science in Engineering|Master og Science in Architectural Engineering|kandidat";"Bygningsdesign|Master of Science in Engineering|Master og Science in Architectural Engineering|kandidat";"und";"5795f16a6bbf232e700009d1";"";"5795f16a6bbf232e700009d1";"DTU Department of Civil Engineering";"sorbit";"sorbit";"Investigations of a simple TABS (Thermally Activated Building System) installed in a refurbished office building|Undersøgelser af et simpelt TABS anlæg i en energirenoveret bygning"
"";"dtu|dtupub|third_party";"";"2022-01-03T13:16:25.187Z";"Krøjer, Michelle Andreasen";"";"2306789378";"";"dtu";"2016";"";"";"";"";"thesis";"dtu|dtu_electronic|dtupub_external";"";"";"";"";"";"";"";"";"";"";"";"";"";"Bioteknologi|Master of Science in Biotechnology|Master of Science in Engineering|kandidat";"Bioteknologi|Master of Science in Biotechnology|Master of Science in Engineering|kandidat";"Bioteknologi|Master of Science in Biotechnology|Master of Science in Engineering|kandidat";"und";"579743686bbf232e70000dc6";"";"579743686bbf232e70000dc6";"DTU National Veterinary Institute";"sorbit";"sorbit";"Genomic analysis of endogenous gamma delta T cell receptor ligands in pigs versus humans|Genomisk analyse af endogene ligander for gamma delta T celle receptorer i svin og menneske"
