"abstract_ts";"access_ss";"Affiliations";"Timestamp";"Author";"citation_count_i";"ID";"dtu_library_collection_facet";"collection_facet";"Publication Year";"Conference";"DOI";"Editor";"embargo_ssf";"format";"fulltext_availability_facet";"has_openaccess_fulltext_b";"holdings_ssf";"ISBN";"Journal Issue";"journal_issue_tsort";"journal_oa_model_ss";"Journal Page";"journal_page_start_tsort";"Journal Title";"journal_title_facet";"toc_key_s";"Journal Volume";"journal_vol_tsort";"keywords_ts";"keywords_facet";"keywords_normalized";"isolanguage_facet";"member_id_ss";"ORCID";"primary_member_id_s";"Publisher";"Source";"source_all_ss";"Title"
"";"dtu|dtupub|third_party";"";"2022-01-03T13:14:38.516Z";"Larsen, Malte Peter Pejstrup|Hvilsom, Emil Midtgaard";"";"2292741870";"";"dtu";"2013";"";"";"";"";"thesis";"dtu|dtu_electronic|dtupub_external";"";"";"";"";"";"";"";"";"";"";"";"";"";"Byggetek.|Master of Science in Civil Engineering|Master of Science in Engineering|kandidat";"Byggetek.|Master of Science in Civil Engineering|Master of Science in Engineering|kandidat";"Byggetek.|Master of Science in Civil Engineering|Master of Science in Engineering|kandidat";"und";"56d754d3bf194551020017a3";"";"56d754d3bf194551020017a3";"DTU Department of Civil Engineering";"sorbit";"sorbit";"A Parameter Study of CPTs in Paleogene Clays|A Parameter Study of CPTs in Paleogene Clays"
"";"dtu|dtupub|third_party";"";"2022-01-03T13:16:52.023Z";"Hossaini, Said Mehdi";"";"2439168832";"";"dtu";"2018";"";"";"";"";"thesis";"dtu|dtu_electronic|dtupub|dtupub_electronic";"";"";"";"";"";"";"";"";"";"";"";"";"";"";"";"";"und";"5b97a306d9001d671923a494";"";"5b97a306d9001d671923a494";"DTU Department of Space Research and Space Technology";"sorbit";"sorbit";"Design and Implementation of a Microwave Radiometer for C-band|Design og implementering af et mikrobølgeradiometer til C-band"
"";"dtu|dtupub|third_party";"";"2022-01-06T23:54:15.892Z";"Henning, Mie Vesterskov";"";"2437945965";"";"dtu";"2018";"";"";"";"";"thesis";"dtu|dtu_electronic|dtupub|dtupub_electronic";"";"";"";"";"";"";"";"";"";"";"";"";"";"";"";"";"und";"5b5466625010df0180324851";"";"5b5466625010df0180324851";"DTU Department of Civil Engineering";"sorbit";"sorbit";"Electrodialytic extraction of phosphorus from waste water|Elektrodialytisk ekstraktion af fosfor fra spildevand"
"";"dtu|dtupub|third_party";"";"2022-01-03T13:05:37.099Z";"Harslund, Peter Wulff";"";"2437946037";"";"dtu";"2018";"";"";"";"";"thesis";"dtu|dtu_electronic|dtupub|dtupub_electronic";"";"";"";"";"";"";"";"";"";"";"";"";"";"";"";"";"und";"5b5466945010df018032490f";"";"5b5466945010df018032490f";"DTU Department of Civil Engineering";"sorbit";"sorbit";"Design strategies to avoid glare problems in classrooms and meeting rooms|Design strategier til at undga blænding i undervisningslokaler og møderum"
"";"dtu|dtupub|third_party";"";"2022-01-03T13:05:39.479Z";"Keren, Noé";"";"2438076065";"";"dtu";"2018";"";"";"";"";"thesis";"dtu|dtu_electronic|dtupub_external";"";"";"";"";"";"";"";"";"";"";"";"";"";"";"";"";"und";"5b6043dd5010df0180324c7e";"";"5b6043dd5010df0180324c7e";"DTU Department of Technology, Management and Economics";"sorbit";"sorbit";"Supply Chain Planning Using Machine Learning and Artificial Intelligence|Supply Chain Planning ved hjælp af maskinlæring og kunstig intelligens"
"";"dtu|dtupub|third_party";"";"2022-01-11T08:43:53.474Z";"Masouridis, Marios";"";"2525226570";"";"dtu";"2020";"";"";"";"";"thesis";"dtu|dtu_electronic|dtupub|dtupub_electronic";"";"";"";"";"";"";"";"";"";"";"";"";"";"";"";"";"und";"5e8476f1d9001d0ae019bedb";"";"5e8476f1d9001d0ae019bedb";"DTU Department of Space Research and Space Technology";"sorbit";"sorbit";"Design and Construction of a Continuous Wave Radar for Educational use|Design og opbygning af en continuous wave radar til uddannelsesbrug"
"";"dtu|dtupub|third_party";"";"2022-01-06T23:54:31.639Z";"Sandoval, Mario Alfredo Montoya";"";"2597481411";"";"dtu";"2020";"";"";"";"";"thesis";"dtu|dtu_electronic|dtupub|dtupub_electronic";"";"";"";"";"";"";"";"";"";"";"";"";"";"";"";"";"und";"5f5f5008d9001d01706cbd07";"";"5f5f5008d9001d01706cbd07";"DTU Department of Electrical Engineering";"sorbit";"sorbit";"Characterization of acoustic material properties using the acousto-optic effect|Maling af de akustiske egenskaber af materialer med den akusto-optisk effekt"
"";"dtu|dtupub|third_party";"";"2022-01-03T13:13:17.884Z";"Struck, Anders Møller";"";"2612550200";"";"dtu";"2021";"";"";"";"";"thesis";"dtu|dtu_electronic|dtupub_external";"";"";"";"";"";"";"";"";"";"";"";"";"";"";"";"";"und";"602913a9d9001d01657f8582";"";"602913a9d9001d01657f8582";"DTU Department of Applied Mathematics and Computer Science";"sorbit";"sorbit";"Design of a Dynamic Reconfigurable Architecture and Manager for FPGA-based Acceleration|Design af en Dynamisk Rekonfigurerbar Arkitektur og Manager for FPGA-baseret Acceleration."
"";"dtu|dtupub|third_party";"";"2022-01-03T13:13:24.565Z";"Ariyasinghe, Withanage Malmindi Srimale|Kurukuladithya, Handunkuttihettige Don Shamal Surain";"";"2610630901";"";"dtu";"2020";"";"";"";"";"thesis";"dtu|dtu_electronic|dtupub_external";"";"";"";"";"";"";"";"";"";"";"";"";"";"";"";"";"und";"5fef11c8d9001d016c586153";"";"5fef11c8d9001d016c586153";"DTU Department of Health Technology";"sorbit";"sorbit";"Pressure gradient estimation using ultrasound|Trykgradient estimation med ultralyd"
"";"dtu|dtupub|third_party";"";"2022-01-03T13:05:49.354Z";"Jacobsen, Martin Arentoft";"";"2494015354";"";"dtu";"2020";"";"";"";"";"thesis";"dtu|dtu_electronic|dtupub|dtupub_electronic";"";"";"";"";"";"";"";"";"";"";"";"";"";"";"";"";"und";"5e3d5408d9001d01637ca3e9";"";"5e3d5408d9001d01637ca3e9";"DTU Department of Electrical and Photonics Engineering";"sorbit";"sorbit";"Modeling thermo-optic modal instabilities in high-power fiber amplifiers with pump noise|Modellering af termo-optisk modal ustabilitet i højeffekts-fiberforstærkere med pumpestøj"
"";"dtu|dtupub|third_party";"";"2022-01-03T13:13:42.116Z";"Brunak, Karla";"";"2489514290";"";"dtu";"2019";"";"";"";"";"thesis";"dtu|dtu_electronic|dtupub_external";"";"";"";"";"";"";"";"";"";"";"";"";"";"";"";"";"und";"5e341994d9001d01573c14d9";"";"5e341994d9001d01573c14d9";"DTU Department of Electrical Engineering";"sorbit";"sorbit";"Optimisation of the energy system in Aasiaat, Greenland, by integration of renewable energy|Optimering af energisystemet i Aasiaat, Grønland, ved integration af vedvarende energi"
"";"dtu|dtupub|third_party";"";"2022-01-03T13:05:13.291Z";"Suhr, Jacob";"";"2446627964";"";"dtu";"2019";"";"";"";"";"thesis";"dtu|dtu_electronic|dtupub_external";"";"";"";"";"";"";"";"";"";"";"";"";"";"";"";"";"und";"5cbbc0d8d9001d016b475afd";"";"5cbbc0d8d9001d016b475afd";"DTU Department of Civil and Mechanical Engineering";"sorbit";"sorbit";"Efficient evaluation of nonlinear excitation and hydrostatic forces on a barge-like wave energy device|Effektiv beregning af ikke lineær eksitations og hydrostatiske krafter pa et pram formede bølgeenergi anlæg."
"";"dtu|dtupub|third_party";"";"2022-01-03T13:05:44.127Z";"Petersen, Martin Hatting";"";"2453338068";"";"dtu";"2019";"";"";"";"";"thesis";"dtu|dtu_electronic|dtupub_external";"";"";"";"";"";"";"";"";"";"";"";"";"";"";"";"";"und";"5d6e4aadd9001d66e8021842";"";"5d6e4aadd9001d66e8021842";"DTU Department of Applied Mathematics and Computer Science";"sorbit";"sorbit";"Question answering with deep learning|Dyb læring for spørgsmal svar"
"";"dtu|dtupub|third_party";"";"2022-01-03T13:16:38.371Z";"Sørensen, Steen Lyngø";"";"2693004440";"";"dtu";"2021";"";"";"";"";"thesis";"dtu|dtu_electronic|dtupub_external";"";"";"";"";"";"";"";"";"";"";"";"";"";"";"";"";"und";"61262523d9001d047836908a";"";"61262523d9001d047836908a";"DTU Department of Health Technology";"sorbit";"sorbit";"Machine learning for motion tracking during MRI with the help of an EEG-system|Machine Learning til bevægelsesmaling under MR-skanning ved hjælp af et EEG-system"
"";"dtu|dtupub|third_party";"";"2022-01-03T13:05:29.049Z";"Jørgensen, Gustav Alexander";"";"2686027347";"";"dtu";"2021";"";"";"";"";"thesis";"dtu|dtu_electronic|dtupub|dtupub_electronic";"";"";"";"";"";"";"";"";"";"";"";"";"";"";"";"";"und";"606d9326d9001d0166530599";"";"606d9326d9001d0166530599";"DTU Department of Space Research and Space Technology";"sorbit";"sorbit";"Core flows inferred from Swarm satellite magnetic data|Strømninger i Jordens kerne udledt fra SWARM-data"
"";"dtu|dtupub|third_party";"";"2023-12-31T01:09:29.797Z";"Günzel, Constantin";"";"2730671495";"";"dtu";"2023";"";"";"";"";"thesis";"dtu|dtu_electronic|dtupub|dtupub_electronic";"";"";"";"";"";"";"";"";"";"";"";"";"";"";"";"";"und";"6590bf45f49eeb2bb9c4c38d";"";"6590bf45f49eeb2bb9c4c38d";"DTU Department of Space Research and Space Technology";"sorbit";"sorbit";"Deep learning framework for ship detection in commercial SAR images|Deep learning framework for ship detection in commercial SAR images"
"";"dtu|dtupub|third_party";"";"2025-03-25T08:05:41.192Z";"Sigil, Michalina Josephine";"";"2869723457";"";"dtu";"2025";"";"";"";"";"thesis";"dtu|dtu_electronic|dtupub|dtupub_electronic";"";"";"";"";"";"";"";"";"";"";"";"";"";"";"";"";"und";"67e263d4e4710a1248d84813";"";"67e263d4e4710a1248d84813";"DTU Department of Space Research and Space Technology";"sorbit";"sorbit";"A study of sea ice near tide gauges in Greenland|Studie af havis nær tidevandsmalere i Grønland"
"";"dtu|dtupub|third_party";"";"2023-08-01T00:10:48.420Z";"Kristmar, Kristian Villadsen";"";"2727447822";"";"dtu";"2023";"";"";"";"";"thesis";"dtu|dtu_electronic|dtupub|dtupub_electronic";"";"";"";"";"";"";"";"";"";"";"";"";"";"";"";"";"und";"64c84d88eca4b01f4f12c947";"";"64c84d88eca4b01f4f12c947";"DTU Department of Space Research and Space Technology";"sorbit";"sorbit";"Automated Marine Gravity Surveys in Danish Waters: Extending Cross-Survey Marine Frame|Automatiske Søgravimetriske Togter i Danske Farvande: Udvidelse af Søgravimetrisk Reference pa Tværs af Togterne"
"";"dtu|dtupub|third_party";"";"2022-01-03T13:11:08.111Z";"Requeson, Oscar Ramirez";"";"2292738252";"";"dtu";"2014";"";"";"";"";"thesis";"dtu|dtu_electronic|dtupub|dtupub_electronic";"";"";"";"";"";"";"";"";"";"";"";"";"";"Master of Science in Engineering|Master of Science in Wind Energy|Vindenergi|kandidat";"Master of Science in Engineering|Master of Science in Wind Energy|Vindenergi|kandidat";"Master of Science in Engineering|Master of Science in Wind Energy|Vindenergi|kandidat";"und";"56d754bebf19455102000c5f";"";"56d754bebf19455102000c5f";"DTU Department of Wind and Energy Systems";"sorbit";"sorbit";"Identification of Modal Parameters Applying Operational Modal Analysis on a Full Scale Operating Vestas V27 Wind Turbine|Identifikation af modalparametre ved hjælp af Operational Modal Analysis anvendt pa en full-scale Vestas V27 vindmølle i drift"
"";"dtu|dtupub|third_party";"";"2022-01-03T13:15:25.041Z";"Hansen, Thomas Harries";"";"2292737522";"";"dtu";"2015";"";"";"";"";"thesis";"dtu|dtu_electronic|dtupub_external";"";"";"";"";"";"";"";"";"";"";"";"";"";"Elektrotek.|Master of Science in Electrical Engineering|Master of Science in Engineering|kandidat";"Elektrotek.|Master of Science in Electrical Engineering|Master of Science in Engineering|kandidat";"Elektrotek.|Master of Science in Electrical Engineering|Master of Science in Engineering|kandidat";"und";"56d754bbbf19455102000a0e";"";"56d754bbbf19455102000a0e";"DTU Department of Space Research and Space Technology";"sorbit";"sorbit";"Harmonic noise reduction in Doppler radar systems|Reducering af harmonisk støj i Doppler radar systemer"
"";"dtu|dtupub|third_party";"";"2022-01-03T13:07:47.358Z";"Pedersen, Zascha Irving";"";"2292739068";"";"dtu";"2014";"";"";"";"";"thesis";"dtu|dtu_electronic|dtupub_external";"";"";"";"";"";"";"";"";"";"";"";"";"";"gæst dk";"gæst dk";"gæst dk";"und";"56d754c2bf19455102000eb4";"";"56d754c2bf19455102000eb4";"DTU National Veterinary Institute";"sorbit";"sorbit";"Significance of milk feeding strategies for development of cryptosporidiosis and giardiasis in dairy calves|Infektion med Cryptosporidium og Giardia hos smakalve - betydning af mælkefodringsstrategier for smittepres og sygdomsforekomst"
"";"dtu|dtupub|third_party";"[affiliation name could not be established]|Institut for Informatik og Matematisk Modellering, Danmarks Tekniske Universitet|[affiliation unknown]";"2022-01-03T18:57:01.375Z";"Bornhøft, Magnus|Carvalho, Miguel";"";"2392816564";"";"";"2004";"";"";"";"";"thesis";"dtu_external|dtupub_external";"";"";"";"";"";"";"";"";"";"";"";"";"";"";"";"";"und";"5a02e3395010df4c820fe63f";"";"5a02e3395010df4c820fe63f";"Institut for Informatik og Matematisk Modellering, Danmarks Tekniske Universitet, DTU";"etd";"etd";"Hierarkisk distribueret IDS ved anvendelse af neural net"
"";"dtu|dtupub|third_party";"[affiliation name could not be established]|Institut for Informatik og Matematisk Modellering, Danmarks Tekniske Universitet|[affiliation unknown]";"2022-01-03T18:57:20.739Z";"Christensen, Lars P.B.";"";"2392817888";"";"dtu";"2003";"";"";"";"";"thesis";"dtu|dtu_electronic|dtupub|dtupub_electronic";"";"";"";"";"";"";"";"";"";"";"";"";"";"";"";"";"und";"5a02e3535010df4c820feb6f";"";"5a02e3535010df4c820feb6f";"Department of Informatics and Mathematical Modeling, Technical University of Denmark, DTU";"etd";"etd";"Signal processing for ultra-wideband systems"
"Graphical specification notations have gained much popularity in software engineering, as witnessed by the widespread adoption of UML throughout the software industry. Graphical notations are generally characterised by being intuitive to understand, i.e. new users of these notation require little training to become familiar with them. However, few of the graphical notations have a formally defined meaning, so diagrams expressed in such notations are ambiguous - a highly undesirable property for a specification notation. In contrast, formal specification languages have a formally defined mathematical meaning but are comprehensible only to properly educated software engineers. The implication of this is that specifications developed using formal languages are not immediately understandable to the customers and domain experts, and therefore they are difficult to validate. In this thesis we describe the graphical notations of Live Sequence Charts and Statecharts and propose a method using diagrams in these notations for constraining a formal speci cation expressed in a subset of the RAISE Specification Language. Furthermore, we propose a development method that combines the traditional approach with that of formal development. We give a small example illustrating the application of this method. In Danish: Grafiske specifikationsnotationer har opnået stor popularitet indenfor softwareudvikling, hvilket blandt andet ses i den store udbredelse af UML i softwareindustrien. Grafiske notationer er generelt set karakteriseret ved at være intuitive at forstå, det vil sige at nye brugere af disse notationer har kun behov for kortvarig træning for at bliver fortrolige med dem. Desværre er det kun få grafiske notationer, som har en formelt matematisk defineret betydning. Derfor vil diagrammer udtrykt i sådanne notationer som oftest være tvetydige, hvilket er en uhensigtsmæssig egenskab ved en notation beregnet til specifikation. Modsætningen er formelle specfikationssprog, der har en præcis matematisk defineret betydning, men som kun er forståelige for veluddannede softwareudviklere. Resultatet er, at specifikationer udarbejdet ved brug af formelle notationer ikke umiddelbart kan forstås af kunder og eksperter i domænet, hvilket medfører at disse specifikationer er svære at validere. I denne afhandling beskriver vi de to grafiske notationer Live Sequence Charts og Statecharts og foreslår en metode, der bruger diagrammer udtrykt i disse notationer til at opstille betingelser som skal opfyldes af en formel specifikation skrevet i et uddrag af sproget RAISE Specification Language. Desuden foreslås en udviklingsmetode, som kombinerer den traditionelle metode med den model, der bruges indenfor formel softwareudvikling. Metoden illustreres med et mindre eksempel på dens anvendelse.";"dtu|dtupub|third_party";"[affiliation name could not be established]|Department of Informatics and Mathematical Modeling, Technical University of Denmark|[affiliation unknown]";"2022-01-03T18:57:09.394Z";"Madsen, Christian Krog";"";"2392817158";"";"dtu";"2003";"";"";"";"";"thesis";"dtu|dtu_electronic|dtupub|dtupub_electronic";"";"";"";"";"";"";"";"";"";"";"";"";"";"Specification methods|RAISE Specication Language|graphical specification techniques|Live Sequence Charts|Statecharts.";"Live Sequence Charts|RAISE Specication Language|Specification methods|Statecharts.|graphical specification techniques";"Specification methods|RAISE Specication Language|graphical specification techniques|Live Sequence Charts|Statecharts.";"und";"5a02e3455010df4c820fe893";"";"5a02e3455010df4c820fe893";"Department of Informatics and Mathematical Modeling, Technical University of Denmark, DTU";"etd";"etd";"Integration of Specification Techniques"
"General principles for cleaning waste water and alternative methods for removing nickel and vanadium are described";"dtu|dtupub|third_party";"Center for Phase Equilibria and Separation Processes, Department of Chemical Engineering, Technical University of Denmark";"2022-01-03T18:57:21.623Z";"Feldskov, Martin";"";"2392817979";"";"";"2005";"";"";"";"";"thesis";"dtu_external|dtupub_external";"";"";"";"";"";"";"";"";"";"";"";"";"";"";"";"";"und";"5a02e3545010df4c820febcb";"";"5a02e3545010df4c820febcb";"";"etd";"etd";"Precipitation of Vanadium and Nickel salts"
"";"dtu|dtupub|third_party";"[affiliation name could not be established]|Computer Science and Engineering, Informatics and Mathematical Modelling, Technical University of Denmark|[affiliation unknown]";"2022-01-03T18:57:07.184Z";"Becker, Philippe Devantier";"";"2392816974";"";"";"2008";"";"";"";"";"thesis";"dtu_external|dtupub_external";"";"";"";"";"";"";"";"";"";"";"";"";"";"";"";"";"und";"5a02e3415010df4c820fe7d9";"";"5a02e3415010df4c820fe7d9";"";"etd";"etd";"Introducing 802.1x on the Wired Network at Novo Nordisk"
"";"dtu|dtupub|third_party";"Danmarks Tekniske Universitet|innovation og bæredygtighed, Institut for Planlægning, Innovation og Ledelse, Danmarks Tekniske Universitet";"2022-01-03T18:57:33.314Z";"Larsen, Marie Louise M";"";"2392818705";"";"";"2010";"";"";"";"";"thesis";"dtu_external|dtupub_external";"";"";"";"";"";"";"";"";"";"";"";"";"";"";"";"";"und";"5a02e3625010df4c820feea6";"";"5a02e3625010df4c820feea6";"Technical University of Denmark (DTU)";"etd";"etd";"Design with people in developing countries: a master thesis on participatory field research and design tools"
"";"dtu|dtupub|third_party";"[affiliation name could not be established]|[affiliation unknown]";"2022-01-03T18:56:56.391Z";"Poulsen, Troels";"";"2392816277";"";"";"2003";"";"";"";"";"thesis";"dtu_external|dtupub_external";"";"";"";"";"";"";"";"";"";"";"";"";"";"";"";"";"und";"5a02e3345010df4c820fe520";"";"5a02e3345010df4c820fe520";"";"etd";"etd";"Ausferritisk SG-jern, ADI"
"This project covers the development of an actor-based framework for the SunSPOT platform, a wireless sensor from Sun Microsystems. It covers the possibility for implementing a framework, given a hardware unit with built in communication stack. Different languages will be compared to the actor definition and whether they can be used on the J2ME platform. Implementation of load balancing will be attempted. Communication on the SunSPOT is tested and the results show that once a route has been created the time to send a message is very low, and almost the same if the packet is sent through 2 or 6 SunSPOTs. An actor system is defined and Scala, Erlang, JavaSpace, SALSA and Kilim is compared to this definition. It is also tested whether they can be used on the SunSPOT platform. Therefore a framework is made since the languages was not able to run on the SunSPOT. The interface between the user and the framework is designed to be small and simple. The framework is designed so the user only needs to extend one class and will have access to all the needed functions. The design of the framework includes load balancing, and a give a single integer, which represents the load. The framework is implemented in Java on the SunSPOT. Load balancing was not brought to a working state, but will be a future extension of the framework. Tests are performed on the framework. The results of the tests show the framework’s possibility to create actors on remote hosts and communicate with those actors.";"dtu|dtupub|third_party";"[affiliation name could not be established]|Embedded Systems Engineering, Department of Informatics and Mathematical Modeling, Technical University of Denmark|[affiliation unknown]";"2022-01-03T18:57:11.984Z";"Askirk, David Christian";"";"2392817239";"";"dtu";"2009";"";"";"";"";"thesis";"dtu|dtu_electronic|dtupub|dtupub_electronic";"";"";"";"";"";"";"";"";"";"";"";"";"";"";"";"";"und";"5a02e3465010df4c820fe8e6";"";"5a02e3465010df4c820fe8e6";"Technical University of Denmark (DTU)";"etd";"etd";"Actor based framework for SunSPOTs"
"";"dtu|dtupub|third_party";"[affiliation name could not be established]|Institut for Informatik og Matematisk Modellering, Danmarks Tekniske Universitet|Institut for Elektroteknologi, Danmarks Tekniske Universitet|[affiliation unknown]";"2022-01-03T18:57:19.077Z";"Binzer, Eskil|Christiansen, Søren Sølling";"";"2392817773";"";"dtu";"2006";"";"";"";"";"thesis";"dtu|dtu_electronic|dtupub|dtupub_electronic";"";"";"";"";"";"";"";"";"";"";"";"";"";"";"";"";"und";"5a02e3505010df4c820feafd";"";"5a02e3505010df4c820feafd";"Institut for Informatik og Matematisk Modellering, Danmarks Tekniske Universitet, DTU";"etd";"etd";"Håndtering af billeddata fra NOAA-vejrsatellitter"
"";"dtu|dtupub|third_party";"[affiliation name could not be established]|[affiliation unknown]";"2022-01-03T18:57:09.177Z";"Johansen, Dan Mario";"";"2392817085";"";"";"2005";"";"";"";"";"thesis";"dtu_external|dtupub_external";"";"";"";"";"";"";"";"";"";"";"";"";"";"";"";"";"und";"5a02e3435010df4c820fe849";"";"5a02e3435010df4c820fe849";"";"etd";"etd";"Investigation of Topas® for use in optical components"
"In this thesis the field of Musical Information retrieval was introduced in order to provide the setting for the main subject of the thesis: ´´Instrument Detection in Music”. A spectrogram alike quantity was developed using a Constant Q Transform, to facilitate the investigation of harmonic content of music signals, and to form the basis components used in one of two methods being developed. A classification framework consisting of two methods, namely Sparse Nonnegative Matrix Factor 2 dimensional Deconvolution and reduced Kernel Partial Least Squares, were implemented and applied to Instruments detection. Samples of a philharmonic orchestra were used to construct several test sets, produced in a software sequencer. Experiments showed that the proposed methods are suitable for the task of Instrument Detection in Music.";"dtu|dtupub|third_party";"[affiliation name could not be established]|Intelligent Signal Processing, Department of Informatics and Mathematical Modeling, Technical University of Denmark|[affiliation unknown]";"2022-01-03T18:56:44.643Z";"Hjorth-Jensen, Frederik";"";"2392815497";"";"dtu";"2008";"";"";"";"";"thesis";"dtu|dtu_electronic|dtupub|dtupub_electronic";"";"";"";"";"";"";"";"";"";"";"";"";"";"";"";"";"und";"5a02e3255010df4c820fe20c";"";"5a02e3255010df4c820fe20c";"";"etd";"etd";"Instrument Detection in Music"
"";"dtu|dtupub|third_party";"Sektion for Kystøkologi, Institut for Akvatiske Ressourcer, Danmarks Tekniske Universitet";"2022-01-03T18:57:03.198Z";"Kristensen, Louise";"";"2392816720";"";"dtu";"2008";"";"";"";"";"thesis";"dtu|dtu_electronic|dtupub|dtupub_electronic";"";"";"";"";"";"";"";"";"";"";"";"";"";"";"";"";"und";"5a02e33c5010df4c820fe6ce";"";"5a02e33c5010df4c820fe6ce";"";"etd";"etd";"Kryptisk adfærd  hos naive og tilvænnede juvenile pighvarrer Psetta maxima (L.)  og skrubber Platichthys flesus (L.)"
"";"dtu|dtupub|third_party";"";"2025-09-02T00:09:46.206Z";"Toft, Gustav";"";"2873503399";"";"dtu";"2025";"";"";"";"";"thesis";"dtu|dtu_electronic|dtupub|dtupub_electronic";"";"";"";"";"";"";"";"";"";"";"";"";"";"";"";"";"und";"68b635ca43220d8f09bc20fc";"";"68b635ca43220d8f09bc20fc";"DTU Department of Applied Mathematics and Computer Science";"sorbit";"sorbit";"Deep Leaning Vision Models for Generalized Counting|Deep Learning Vision-modeller til generaliseret tælling"
"";"dtu|dtupub|third_party";"";"2025-09-02T00:09:51.701Z";"Mercuri, Giorgia";"";"2873503483";"";"dtu";"2025";"";"";"";"";"thesis";"dtu|dtu_electronic|dtupub|dtupub_electronic";"";"";"";"";"";"";"";"";"";"";"";"";"";"";"";"";"und";"68b635cf1825f68f0936cc60";"";"68b635cf1825f68f0936cc60";"DTU Department of Health Technology";"sorbit";"sorbit";"Do overall signal frequency components influence Motor Unit Potential size?|Pavirker overordnede signalfrekvenskomponenter motorenhedens potentialestørrelse?"
"";"dtu|dtupub|third_party";"";"2025-09-04T00:09:53.959Z";"González, Carla Rodrigo";"";"2873546652";"";"dtu";"2025";"";"";"";"";"thesis";"dtu|dtu_electronic|dtupub|dtupub_electronic";"";"";"";"";"";"";"";"";"";"";"";"";"";"";"";"";"und";"68b8d8d1f79e288f09f6bb23";"";"68b8d8d1f79e288f09f6bb23";"DTU National Institute of Aquatic Resources";"sorbit";"sorbit";"Combined effect of climate change and crude oil pollution on the larval development of blue mussels (Mytilus edulis)|Kombineret effekt af klimaforandring og olieforurening pa larveudviklingen af blamuslinger (Mytilus edulis)"
